id,owner,name,content,source_name_ru,source_content_ru
PROC-01,ORG-ARTIFACT,Start from archive,Accept the ZIP as the load document; unpack it into a temporary contour; do not treat separate files as a full package.,Старт из архива,Принять ZIP как загрузочный документ; распаковать во временный контур; не считать отдельные файлы полным пакетом.
PROC-02,ORG-ARTIFACT,Manifest and hash check,"Compare manifest.json, hashes.sha256, version, file composition, and checksums.",Проверка манифеста и хэшей,"Сверить manifest.json, hashes.sha256, версию, состав файлов и контрольные суммы."
PROC-03,ORG-RECOVERY,PDF canon reading,"Read the PDF as a human-readable canonical surface; recover purpose, evidence boundary, and P0-P7.",Чтение PDF-канона,"Прочитать PDF как человекочитаемую каноническую поверхность; восстановить назначение, границу доказательности и P0-P7."
PROC-04,ORG-LEXICON,Glossary loading,"Recover terms, abbreviations, UCE, Sokrat, BOIS/BORIS/SIMA, and S0-S4 before practical use.",Загрузка словаря,"Восстановить термины, аббревиатуры, UCE, Сократ, BOIS/BORIS/SIMA и S0-S4 до практического применения."
PROC-05,ORG-OPERATOR,Authority setup,"Fix the operator, goal, consent, constraints, human procedure, and finalization conditions.",Установка полномочия,"Зафиксировать оператора, цель, согласие, ограничения, человеческую процедуру и условия финализации."
PROC-06,ORG-DOMAIN,Domain level selection,Determine D0-D3 and the required volume of domain physiology without replacing the core by the domain.,Выбор уровня домена,"Определить D0-D3 и требуемый объём доменной физиологии, не подменяя ядро доменом."
PROC-07,ORG-SOKRAT,Sokrat loading,"Load the machine map as derived from the PDF: rules, stops, procedures, tests, state schema, and conflict policy.",Сократ-загрузка,"Загрузить машинную карту как производную от PDF: правила, стопы, процедуры, тесты, state schema и conflict policy."
PROC-08,ORG-IMPLEMENTATION,Autonomous scanner,"Check hidden risks: recency, domain, premises, safety, evidence, authority, substrate, artifact.",Автономный сканер,"Проверить скрытые риски: актуальность, область, предпосылки, безопасность, доказательность, полномочие, субстрат, артефакт."
PROC-09,ORG-REASONING,Semantic reasoning,Run the main cycle: task -> D/V/S -> facts -> assumptions -> inferences -> risks -> unknown -> action -> boundaries.,Смысловой расчёт,Пройти основной цикл: задача -> D/V/S -> факты -> допущения -> выводы -> риски -> неизвестное -> действие -> границы.
PROC-10,ORG-SIMA,SIMA reconstruction,"If a system or behavior is analyzed, fix X/W/D/V/S, evidence, opers, M7, alternatives, risks, and confidence.",SIMA-реконструкция,"Если анализируется система или поведение, зафиксировать X/W/D/V/S, свидетельства, opers, M7, альтернативы, риски и уверенность."
PROC-11,ORG-DOMAIN,Domain physiology connection,"Check that the private implementation is outside the core, compatible with BOIS, and does not cancel P0-P4.",Подключение доменной физиологии,"Проверить, что частная реализация вынесена из ядра, совместима с BOIS и не отменяет P0-P4."
PROC-12,ORG-VERIFY,Result verification,"Compare the conclusion with evidence, applicability, stops, human procedure, QA boundary, and tests.",Проверка результата,"Сопоставить вывод с доказательностью, применимостью, стопами, человеческой процедурой, QA-границей и тестами."
PROC-13,ORG-ARTIFACT,Archive build,"Create a single ZIP with PDF, JSON, tables, manifest, hashes, load order, QA, and theory source.",Сборка архива,"Создать единый ZIP с PDF, JSON, таблицами, манифестом, хэшами, load order [порядком загрузки], QA и theory source [теоретическим источником]."
PROC-14,ORG-RECOVERY,Transition,"Create a transition package: state, accepted conditions, risks, open questions, checks, rollback/fallback path.",Переход,"Создать пакет перехода: state, принятые условия, риски, открытые вопросы, проверки, rollback/fallback path."
PROC-15,ORG-PHYS-COMPAT,Contradiction repair,"Stop action, fix rule IDs and owners, create repair candidate, test, acceptance, and rollback.",Ремонт противоречия,"Остановить действие, зафиксировать ID правил и владельцев, создать кандидат ремонта, тест, принятие и откат."
PROC-16,ORG-RULE-PURITY,Anti-duplicate and anti-bureaucracy,"Check function duplicates, excess objects, norm status, and object usefulness for meaning, verification, responsibility, recovery, risk, or attention.",Анти-дубль и анти-бюрократия,"Проверить дубли функций, лишние объекты, статус нормы и пользу объекта для смысла, проверки, ответственности, восстановления, риска или внимания."
PROC-17,ORG-FORMAT,Answer surface selection,"Classify the task before the final answer. For build, repair, audit, BOIS archive, substantial artifact, conflicts, and self-check, use full/audit or transition and close by FMT-05/FMT-06.",Выбор поверхности ответа,"Классифицировать задачу до финального ответа. Для сборки, ремонта, аудита, BOIS-архива, существенного артефакта, конфликтов и самопроверки применять full/audit [полно/аудиторски] или transition [переходно] и закрывать ответ по FMT-05/FMT-06."
PROC-18,ORG-COMPLETION,Auto-completion #50,"Update operator_message_count at every operator message. At 50 or explicit #50, switch current_mode to transition, assemble a memory transfer package, and do not continue the ordinary task without explicit cancellation.",Автозавершение #50,"На каждом сообщении оператора обновить operator_message_count. При 50 или явном #50 переключить current_mode в transition, собрать memory transfer package [пакет переноса памяти] и не продолжать обычную задачу без явной отмены."
PROC-19,ORG-PHIL-MACHINE,Philosophical-machine level check,"If the request concerns philosophical machines as a class, hold M7/M@S and transferability tests. Descend into D2/D3, BORIS implementation, or product runtime only when needed, marking the reason explicitly.",Проверка уровня философской машины,"Если запрос касается философских машин как класса, удержать M7/M@S и тесты переносимости. Спуск в D2/D3, BORIS-реализацию или продуктовый runtime выполнять только по нужде, явно маркируя причину."
PROC-20,ORG-PHYS-COMPAT,Compress bloated contour,"If analysis multiplies frames without benefit, fix STOP-SYSTEM-BLOAT, choose the minimum sufficient level, remove extra answer blocks, and keep only meaningful debts.",Сжатие вздутого контура,"Если анализ множит рамки без прироста пользы, зафиксировать STOP-SYSTEM-BLOAT [стоп-вздутие системы], выбрать минимально достаточный уровень, удалить лишние блоки из поверхности ответа и оставить только значимые долги."
PROC-21,ORG-VERIFY,Universal simulation before archive delivery,"Before delivering any BOIS archive, run the maximum available checks: format defect, visible number and verbosity, #50 and post-#50 mode, M/M@S level, rule conflict, high risk, visual readability of all PDFs, hashes, recovery from ZIP, and load order.",Универсальная имитация перед выдачей архива,"Перед выдачей любого BOIS-архива прогнать максимально доступные проверки: форматный дефект, видимый номер и степень подробности, #50 и режим после #50, уровень M/M@S [машина/машина на субстрате], конфликт правил, высокий риск, визуальную читаемость всех PDF, хэши, восстановление из ZIP и загрузочный порядок."
PROC-VISUAL-PDF-REPAIR,ORG-ARTIFACT,PDF repair before archive delivery,"On visual FAIL: identify readability defects, rebuild the PDF as Human Core plus Registry Appendix or another sufficient two-layer format, forbid ID breaks, increase font readability, check diagrams and tables by rendering, then repeat QA until PASS. This applies to any BOIS archive.",Ремонт PDF перед выдачей архива,"При визуальном FAIL [провале]: выделить дефекты читаемости, пересобрать PDF как Human Core [человеческое ядро] плюс Registry Appendix [реестровое приложение] или другой достаточный двухслойный формат, запретить разрыв ID, поднять читаемость шрифта, проверить схемы и таблицы рендером, затем повторить QA [контроль качества] до PASS [проверка пройдена]. Правило действует для любого BOIS-архива, а не только для публикационной, личной, доменной или голой сборки."
PROC-AUTHOR-SUPPORT-MESSAGE,ORG-SURFACE,Show author support message,"In the first greeting and every physiology archive request, show the author support message in the operator language. Preserve the Patreon, Ko-fi, Buy Me a Coffee, and About me links unchanged.",Показ авторского сообщения поддержки,В первом приветственном сообщении и при каждом запросе физиологического архива вывести авторское сообщение поддержки на языке оператора. В русском контуре использовать русский перевод; URL [ссылки] не изменять.
