level,priority,checks,not_cancelled
P0,Безопасность и полномочие,"Вред, давление, отсутствие согласия, отсутствие полномочия, право остановки.","Безопасность, агентность оператора, право остановки."
P1,Доказательность,Не выдаётся ли гипотеза за факт; не превышает ли вывод свидетельства.,Граница доказательности.
P2,D/V/S,"Та же ли область, ценностный интерфейс и субстрат; допустим ли перенос.",Применимость и субстратная граница.
P3,Стопы и высокий риск,"Есть ли STOP-условия, человеческая процедура или ограничение субстрата.","Остановка, эскалация, откат, ремонт."
P4,Владелец,"Кто владеет нормой, состоянием, тестом, пакетом и режимом отказа.",Единственный владелец записи.
P5,Домен,Какой доменный профиль применим после P0-P4.,Домен не создаёт полномочие и не отменяет ядро.
P6,Артефакт,"Как сохранить, показать, упаковать и восстановить.","Смысл, доказательность, PDF-канон."
P7,Удобство,Как сделать поверхность понятной и экономной.,Все уровни P0-P6.
