norm_id	layer	card_status	candidate_kind	acceptance_status	available_for_evaluation	available_for_application	operator_activation_required	title	formulation	owner	scope	profile_id	norm_type	semantic_target	predicate	trigger	when	modality	execution_mode	operation	desired_value	forbidden_value	exceptions	priority	evidence_requirements	hold	stop	target_state	target_transition	success_criterion	forbidden_state	boundary_conditions	foundations	derivation_refs	tests	principles	required_phase	defect_signal	repair_path	closure_criterion	last_semantic_change_version	last_formulation_change_version	last_machine_semantics_change_version	predecessor_ref	formulation_sha256	semantic_payload_sha256	structural_card_sha256
N-O022-01	BASE	ACTIVE		ACCEPTED_FOR_INTERPRETATION	TRUE	TRUE	FALSE	Memory stores selected state	Memory includes only material traces needed for work, verification, recovery, or mandatory retention.	O022	"[""core"",""organ:O022""]"	STATE_CLOSURE	MANDATORY_RULE	state.memory	state.integrity	"[""organ:O022""]"	"{""op"":""always""}"	MUST	EVIDENCE_EVALUATED	REQUIRE	COMPLIANT		[]	600	"{""counterevidence_policy"":""HOLD"",""freshness_requirement"":""CURRENT"",""independence_requirement"":""IND_ANY"",""minimum_epistemic_status"":""S1"",""minimum_evidence_count"":1,""required_source_classes"":[]}"	"[""STATE_OR_EFFECT_UNKNOWN""]"	"[""FALSE_CLOSURE""]"	COMPLIANT	REQUIRE	state.integrity::COMPLIANT	DECLARED_CONFORMING_STATE	"{""exceptions"":[],""hold"":[""STATE_OR_EFFECT_UNKNOWN""],""stop"":[""FALSE_CLOSURE""]}"	"[""B0"",""C0"",""E0"",""I0"",""T0""]"	"[""DER-JUST-N-O022-01""]"	"[""TC-N-O022-01-NEG"",""TC-N-O022-01-POS"",""TC-POSITIVE-FORMULATION-N-O022-01""]"	"[""CP-01"",""CP-04"",""CP-05""]"	C03|C07|C09|C11|RECOVERY	State, effect, debt, owner, next input, or closure evidence is incomplete.	"[""RESTORE_LAST_VALID_STATE"",""REOPEN_CYCLE"",""RECORD_DEBT"",""CREATE_NEXT_INPUT""]"	Effect, state delta, debt disposition, and next transition are recorded.	2.22	UNKNOWN_PRE_V2.18	2.22	v2.21:N-O022-01	8abc2cf506e6314069fab631f46dc97fd6cf34772fc27e66401269f1041c8657	cd8967eaaf6b82cefa16c92058b39b2232d74fb728aafbce845fd3f90fad606e	7f2a381b1db90179121a2251334fc927f4044245ec173842d7bb2f7530297bea
N-O022-02	BASE	ACTIVE		ACCEPTED_FOR_INTERPRETATION	TRUE	TRUE	FALSE	Six memory classes	Working, episodic, epistemic, procedural, normative, and recovery memory have different selection and correction rules.	O022	"[""core"",""organ:O022""]"	EVIDENCE	MANDATORY_RULE	epistemic.claim	epistemic.status	"[""organ:O022""]"	"{""op"":""always""}"	MUST	EVIDENCE_EVALUATED	REQUIRE	COMPLIANT		[]	600	"{""counterevidence_policy"":""HOLD"",""freshness_requirement"":""CURRENT"",""independence_requirement"":""IND_ANY"",""minimum_epistemic_status"":""S1"",""minimum_evidence_count"":1,""required_source_classes"":[]}"	"[""MISSING_EVIDENCE"",""UNRESOLVED_COUNTEREVIDENCE""]"	"[""EVIDENCE_FABRICATION""]"	COMPLIANT	REQUIRE	epistemic.status::COMPLIANT	DECLARED_CONFORMING_STATE	"{""exceptions"":[],""hold"":[""MISSING_EVIDENCE"",""UNRESOLVED_COUNTEREVIDENCE""],""stop"":[""EVIDENCE_FABRICATION""]}"	"[""B0"",""C0"",""E0"",""I0"",""T0""]"	"[""DER-JUST-N-O022-02""]"	"[""TC-N-O022-02-NEG"",""TC-N-O022-02-POS"",""TC-POSITIVE-FORMULATION-N-O022-02""]"	"[""CP-01"",""CP-04"",""CP-05""]"	C03|C07|RECOVERY	Source, provenance, scope, counterevidence, alternatives, or confidence boundary is incomplete.	"[""REBUILD_PROVENANCE"",""ADD_COUNTEREVIDENCE_CHECK"",""LOWER_CONFIDENCE"",""REOPEN_HYPOTHESIS""]"	The claim status, evidence, counterevidence, scope, and review conditions are recorded.	2.20	UNKNOWN_PRE_V2.18	2.20	v2.21:N-O022-02	4ce455c2c129a323a5a4ec88a14cd76e98673262271cb03a15b0aef8700287f0	3bcdb36b632edf3437b873eeeda2fb47a0331ea4f7e5a3684d69653f7532c9e1	7c9683964d5a934f9d85a42f21fb90a3fce8b725fe9b0a8954c8400feb1e8807
N-O022-03	BASE	ACTIVE		ACCEPTED_FOR_INTERPRETATION	TRUE	TRUE	FALSE	Reasoning evidence remains bounded and inspectable	Mandatory memory stores results, grounds, dependencies, decisions, provenance, and uncertainty; private internal computational sequences remain outside the transferable memory contract.	O022	"[""core"",""organ:O022""]"	STATE_CLOSURE	MANDATORY_RULE	cycle.closure	closure.status	"[""organ:O022""]"	"{""op"":""always""}"	MUST	EVIDENCE_EVALUATED	REQUIRE	COMPLIANT		[]	600	"{""counterevidence_policy"":""HOLD"",""freshness_requirement"":""CURRENT"",""independence_requirement"":""IND_ANY"",""minimum_epistemic_status"":""S1"",""minimum_evidence_count"":1,""required_source_classes"":[]}"	"[""STATE_OR_EFFECT_UNKNOWN""]"	"[""FALSE_CLOSURE""]"	COMPLIANT	REQUIRE	closure.status::COMPLIANT	DECLARED_CONFORMING_STATE	"{""exceptions"":[],""hold"":[""STATE_OR_EFFECT_UNKNOWN""],""stop"":[""FALSE_CLOSURE""]}"	"[""B0"",""C0"",""E0"",""I0""]"	"[""DER-JUST-N-O022-03""]"	"[""TC-N-O022-03-NEG"",""TC-N-O022-03-POS"",""TC-POSITIVE-FORMULATION-N-O022-03""]"	"[""CP-01""]"	C03|C07|C08|C09|C11	State, effect, debt, owner, next input, or closure evidence is incomplete.	"[""RESTORE_LAST_VALID_STATE"",""REOPEN_CYCLE"",""RECORD_DEBT"",""CREATE_NEXT_INPUT""]"	Effect, state delta, debt disposition, and next transition are recorded.	2.22	UNKNOWN_PRE_V2.18	2.22	v2.21:N-O022-03	709165c293822ab65f02921c1e8b1ca572cd80c31d49102e047c99d862e9bb41	39cd7ea7e07f551bab32527ec79f2a3c8d044b4ee896173529d4c515aeebcca4	b90fbec5974eb784177620782fdcfbbb73f4ec6f9066276288b999d45004f99e
N-O022-04	BASE	ACTIVE		ACCEPTED_FOR_INTERPRETATION	TRUE	TRUE	FALSE	Project history remains outside the Personal Layer	Completed history remains historical evidence; activation in a new cycle follows explicit input or an authorized retrieval request.	O022	"[""core"",""organ:O022""]"	AUTHORITY	MANDATORY_RULE	agency.authorization	authorization.status	"[""organ:O022""]"	"{""op"":""fact"",""path"":""violation.N-O022-04"",""equals"":true}"	MUST_NOT	KERNEL_COMPUTED	PROHIBIT		VIOLATED	[]	600	"{""counterevidence_policy"":""HOLD"",""freshness_requirement"":""ANY"",""independence_requirement"":""IND_ANY"",""minimum_epistemic_status"":""S0"",""minimum_evidence_count"":0,""required_source_classes"":[]}"	"[""AUTHORITY_PENDING"",""SCOPE_PENDING""]"	"[""UNAUTHORIZED_EXTERNAL_TRANSITION""]"	DECLARED_CONFORMING_STATE	PROHIBIT	authorization.status::DECLARED_CONFORMING_STATE	VIOLATED	"{""exceptions"":[],""hold"":[""AUTHORITY_PENDING"",""SCOPE_PENDING""],""stop"":[""UNAUTHORIZED_EXTERNAL_TRANSITION""]}"	"[""C0"",""E0"",""I0"",""T0""]"	"[""DER-JUST-N-O022-04""]"	"[""TC-N-O022-04-NEG"",""TC-N-O022-04-POS"",""TC-POSITIVE-FORMULATION-N-O022-04""]"	"[""CP-04"",""CP-05""]"	C03|C07	Actor, scope, delegation, decision owner, or validity evidence is incomplete.	"[""IDENTIFY_AUTHORITY_OWNER"",""OBTAIN_OR_REVOKE_DELEGATION"",""RECALCULATE_SCOPE""]"	A valid authority state, scope, owner, and evidence reference are recorded.	2.20	UNKNOWN_PRE_V2.18	2.20	v2.21:N-O022-04	8737d26fb8bb02ed16bca2f060fe7a467a744b18a5daf8845c694c853552c111	e203f0b78bcdbde890009ec0416d393df97a69cfd99bbb1c4a4181d394cdcc3c	4d8ee5eca3c398972315a8dfe6f17ac7bd387b06e0d358792042ac69cabf2174
N-O022-05	BASE	ACTIVE		ACCEPTED_FOR_INTERPRETATION	TRUE	TRUE	FALSE	Partial history	History records its verified coverage and explicit gaps, and an absent record receives UNKNOWN status.	O022	"[""core"",""organ:O022""]"	STATE_CLOSURE	MANDATORY_RULE	state.memory	state.integrity	"[""organ:O022""]"	"{""op"":""fact"",""path"":""violation.N-O022-05"",""equals"":true}"	MUST_NOT	KERNEL_COMPUTED	PROHIBIT		VIOLATED	[]	600	"{""counterevidence_policy"":""HOLD"",""freshness_requirement"":""ANY"",""independence_requirement"":""IND_ANY"",""minimum_epistemic_status"":""S0"",""minimum_evidence_count"":0,""required_source_classes"":[]}"	"[""STATE_OR_EFFECT_UNKNOWN""]"	"[""FALSE_CLOSURE""]"	DECLARED_CONFORMING_STATE	PROHIBIT	state.integrity::DECLARED_CONFORMING_STATE	VIOLATED	"{""exceptions"":[],""hold"":[""STATE_OR_EFFECT_UNKNOWN""],""stop"":[""FALSE_CLOSURE""]}"	"[""C0"",""E0"",""I0"",""T0""]"	"[""DER-JUST-N-O022-05""]"	"[""TC-N-O022-05-NEG"",""TC-N-O022-05-POS"",""TC-POSITIVE-FORMULATION-N-O022-05""]"	"[""CP-04"",""CP-05""]"	C03|C04|C07|C09|C11	State, effect, debt, owner, next input, or closure evidence is incomplete.	"[""RESTORE_LAST_VALID_STATE"",""REOPEN_CYCLE"",""RECORD_DEBT"",""CREATE_NEXT_INPUT""]"	Effect, state delta, debt disposition, and next transition are recorded.	2.22	UNKNOWN_PRE_V2.18	2.22	v2.21:N-O022-05	0cceda4ef00cc5499189b71504dbae53be24640a14da8438f27f11cdf0dbf255	3ebe6aaa79ece2fc255ebcfaa3c72a28db97ecd85047bcec408afa8a1da937ac	bc3d28f3f266c8a5be9ba8f1e7c3765d7cbbd58d3a29be24682c7e4ca2368641
N-O022-06	BASE	ACTIVE		ACCEPTED_FOR_INTERPRETATION	TRUE	TRUE	FALSE	Correcting history	A historical trace is supplemented by a corrective event rather than rewritten; a working representation may receive a new revision.	O022	"[""core"",""organ:O022""]"	STATE_CLOSURE	MANDATORY_RULE	state.memory	state.integrity	"[""organ:O022""]"	"{""op"":""always""}"	MAY	EVIDENCE_EVALUATED	PERMIT	PERMITTED		[]	600	"{""counterevidence_policy"":""HOLD"",""freshness_requirement"":""CURRENT"",""independence_requirement"":""IND_ANY"",""minimum_epistemic_status"":""S1"",""minimum_evidence_count"":1,""required_source_classes"":[]}"	"[""STATE_OR_EFFECT_UNKNOWN""]"	"[""FALSE_CLOSURE""]"	PERMITTED	PERMIT	state.integrity::PERMITTED	DECLARED_CONFORMING_STATE	"{""exceptions"":[],""hold"":[""STATE_OR_EFFECT_UNKNOWN""],""stop"":[""FALSE_CLOSURE""]}"	"[""C0"",""E0"",""I0"",""T0""]"	"[""DER-JUST-N-O022-06""]"	"[""TC-N-O022-06-NEG"",""TC-N-O022-06-POS"",""TC-POSITIVE-FORMULATION-N-O022-06""]"	"[""CP-04"",""CP-05""]"	C03|C07|C08|C09|C11	State, effect, debt, owner, next input, or closure evidence is incomplete.	"[""RESTORE_LAST_VALID_STATE"",""REOPEN_CYCLE"",""RECORD_DEBT"",""CREATE_NEXT_INPUT""]"	Effect, state delta, debt disposition, and next transition are recorded.	2.22	UNKNOWN_PRE_V2.18	2.22	v2.21:N-O022-06	ed853016a989eef5dd1d10191d0b88ca7c57bf4d7ebe9a8065ab9868aa8f395d	647c90d588ea8e6c053a918be5ff26c3d4ac5d466aea2b4044e39ce8fab41af5	c8d3ff5f1a727dbbd6c647d83c365c85d48589143d0002ba5d7b97a4228ee0c4
N-O022-07	BASE	ACTIVE		ACCEPTED_FOR_INTERPRETATION	TRUE	TRUE	FALSE	Object ownership	O022 retains accountable ownership of its memory object, memory class, inspectable reasoning evidence, history record, partial-history state, and correction record; contributing organs supply typed inputs and preserve ownership of their own outputs.	O022	"[""core"",""organ:O022""]"	AUTHORITY	MANDATORY_RULE	agency.authorization	authorization.status	"[""organ:O022""]"	"{""op"":""fact"",""path"":""violation.N-O022-07"",""equals"":true}"	MUST_NOT	KERNEL_COMPUTED	PROHIBIT		VIOLATED	[]	600	"{""counterevidence_policy"":""HOLD"",""freshness_requirement"":""ANY"",""independence_requirement"":""IND_ANY"",""minimum_epistemic_status"":""S0"",""minimum_evidence_count"":0,""required_source_classes"":[]}"	"[""AUTHORITY_PENDING"",""SCOPE_PENDING""]"	"[""UNAUTHORIZED_EXTERNAL_TRANSITION""]"	DECLARED_CONFORMING_STATE	PROHIBIT	authorization.status::DECLARED_CONFORMING_STATE	VIOLATED	"{""exceptions"":[],""hold"":[""AUTHORITY_PENDING"",""SCOPE_PENDING""],""stop"":[""UNAUTHORIZED_EXTERNAL_TRANSITION""]}"	"[""B0"",""C0"",""E0"",""I0"",""T0"",""V0""]"	"[""DER-JUST-N-O022-07""]"	"[""TC-N-O022-07-NEG"",""TC-N-O022-07-POS"",""TC-POSITIVE-FORMULATION-N-O022-07""]"	"[""CP-01"",""CP-04"",""CP-05"",""CP-06""]"	C03|C07	Actor, scope, delegation, decision owner, or validity evidence is incomplete.	"[""IDENTIFY_AUTHORITY_OWNER"",""OBTAIN_OR_REVOKE_DELEGATION"",""RECALCULATE_SCOPE""]"	A valid authority state, scope, owner, and evidence reference are recorded.	2.20	UNKNOWN_PRE_V2.18	2.20	v2.21:N-O022-07	336ba5c0285add67640b718b59a8be2b9a7a671db9195a6d8bb897dc16306afc	93f33473c71cc11d6fae83142f0234ad072f3e42ecb5178c4124a1c6e4653e3b	50f4df9fbf60ef822ec3205bcc1c177f02c5125a09f980d9d7dc5f22b7b91177
N-O022-10	BASE	ACTIVE		ACCEPTED_FOR_INTERPRETATION	TRUE	TRUE	FALSE	Degradation	When O022 is unavailable, the route remains limited to new independent work on the current input. Operations requiring continuation claims and attribution of unavailable memory become eligible after O022 is restored or an explicitly authorized replacement contract is verified; ownership remains with O022.	O022	"[""core"",""organ:O022""]"	STATE_CLOSURE	MANDATORY_RULE	state.memory	state.integrity	"[""organ:O022""]"	"{""op"":""fact"",""path"":""violation.N-O022-10"",""equals"":true}"	MUST_NOT	KERNEL_COMPUTED	PROHIBIT		VIOLATED	[]	600	"{""counterevidence_policy"":""HOLD"",""freshness_requirement"":""ANY"",""independence_requirement"":""IND_ANY"",""minimum_epistemic_status"":""S0"",""minimum_evidence_count"":0,""required_source_classes"":[]}"	"[""STATE_OR_EFFECT_UNKNOWN""]"	"[""FALSE_CLOSURE""]"	DECLARED_CONFORMING_STATE	PROHIBIT	state.integrity::DECLARED_CONFORMING_STATE	VIOLATED	"{""exceptions"":[],""hold"":[""STATE_OR_EFFECT_UNKNOWN""],""stop"":[""FALSE_CLOSURE""]}"	"[""B0"",""C0"",""D0"",""E0"",""I0"",""V0""]"	"[""DER-JUST-N-O022-10""]"	"[""TC-N-O022-10-NEG"",""TC-N-O022-10-POS"",""TC-POSITIVE-FORMULATION-N-O022-10""]"	"[""CP-01"",""CP-02""]"	C03|C05|C07|C09|C11|RECOVERY	State, effect, debt, owner, next input, or closure evidence is incomplete.	"[""RESTORE_LAST_VALID_STATE"",""REOPEN_CYCLE"",""RECORD_DEBT"",""CREATE_NEXT_INPUT""]"	Effect, state delta, debt disposition, and next transition are recorded.	2.22	UNKNOWN_PRE_V2.18	2.22	v2.21:N-O022-10	f75dfb4a1bceeb58da6fb3e745be6f572f71f5204494b2705d11dbff53403848	8c4dfaa76e82c9b8b7b602ff4b4bbfc26edab50554288b3836b38b6c9f6afeb4	c97c8bb408e4a98e3ebaf687258346ce5b809db2c62fafe2f4257d39f0fb55a2
N-O023-01	BASE	ACTIVE		ACCEPTED_FOR_INTERPRETATION	TRUE	TRUE	FALSE	Recovery modes	Checkpoint, event replay, hybrid, or nonrecoverable mode is selected in advance for each state class.	O023	"[""core"",""organ:O023""]"	STATE_CLOSURE	MANDATORY_RULE	state.memory	state.integrity	"[""organ:O023""]"	"{""op"":""always""}"	MUST	EVIDENCE_EVALUATED	REQUIRE	COMPLIANT		[]	600	"{""counterevidence_policy"":""HOLD"",""freshness_requirement"":""CURRENT"",""independence_requirement"":""IND_ANY"",""minimum_epistemic_status"":""S1"",""minimum_evidence_count"":1,""required_source_classes"":[]}"	"[""STATE_OR_EFFECT_UNKNOWN""]"	"[""FALSE_CLOSURE""]"	COMPLIANT	REQUIRE	state.integrity::COMPLIANT	DECLARED_CONFORMING_STATE	"{""exceptions"":[],""hold"":[""STATE_OR_EFFECT_UNKNOWN""],""stop"":[""FALSE_CLOSURE""]}"	"[""C0"",""E0"",""I0"",""T0""]"	"[""DER-JUST-N-O023-01""]"	"[""TC-N-O023-01-NEG"",""TC-N-O023-01-POS"",""TC-POSITIVE-FORMULATION-N-O023-01""]"	"[""CP-04"",""CP-05""]"	C03|C07|C09|C11|RECOVERY	State, effect, debt, owner, next input, or closure evidence is incomplete.	"[""RESTORE_LAST_VALID_STATE"",""REOPEN_CYCLE"",""RECORD_DEBT"",""CREATE_NEXT_INPUT""]"	Effect, state delta, debt disposition, and next transition are recorded.	2.22	UNKNOWN_PRE_V2.18	2.22	v2.21:N-O023-01	f6ffcf19365bb6e1f18561786e62607ec44a50cb7f88f8a25c9ebe9ac4fe8cd8	ea37ace12cc2d480615a6861b3dcaa5518a59cdd9575db1bffd126273efcef35	9a75f7fa24601dce0cae2302edceceee46fd4fbdf1f17eba495163da57221a29
N-O023-02	BASE	ACTIVE		ACCEPTED_FOR_INTERPRETATION	TRUE	TRUE	FALSE	New cycle	Recovery always opens a new cycle_id and a new execution identity, even when the logical lineage continues.	O023	"[""core"",""organ:O023""]"	RELEASE	MANDATORY_RULE	release.package	release.integrity	"[""organ:O023""]"	"{""op"":""always""}"	MUST	EVIDENCE_EVALUATED	REQUIRE	COMPLIANT		[]	600	"{""counterevidence_policy"":""HOLD"",""freshness_requirement"":""CURRENT"",""independence_requirement"":""IND_ANY"",""minimum_epistemic_status"":""S1"",""minimum_evidence_count"":1,""required_source_classes"":[]}"	"[""PACKAGE_INCOMPLETE""]"	"[""PACKAGE_MISMATCH""]"	COMPLIANT	REQUIRE	release.integrity::COMPLIANT	DECLARED_CONFORMING_STATE	"{""exceptions"":[],""hold"":[""PACKAGE_INCOMPLETE""],""stop"":[""PACKAGE_MISMATCH""]}"	"[""C0"",""E0"",""I0"",""T0"",""V0""]"	"[""DER-JUST-N-O023-02""]"	"[""TC-N-O023-02-NEG"",""TC-N-O023-02-POS"",""TC-POSITIVE-FORMULATION-N-O023-02""]"	"[""CP-03"",""CP-04"",""CP-05""]"	EXTERNAL_ACTION|RECOVERY	Required component, version, manifest entry, checksum, compatibility statement, or verification result is incomplete.	"[""REBUILD_COMPONENT"",""REGENERATE_MANIFEST"",""RECALCULATE_HASHES"",""RERUN_FINAL_VERIFICATION""]"	All required components, hashes, compatibility, and verification statuses are recorded.	2.20	UNKNOWN_PRE_V2.18	2.20	v2.21:N-O023-02	546a1821d9d7a77aff865187d0b2d4107232ef3f7092dbbc1ce29ffaa9b101bd	63a514db0f7d4a046a3217739ab077ed594579de319a9a1503585d5c5a4bfc6a	7c47afbd7135d9899d63499e6d0c016a9957ae273bd7b784b7485c1c659ada20
N-O023-03	BASE	ACTIVE		ACCEPTED_FOR_INTERPRETATION	TRUE	TRUE	FALSE	Package verification	Identity, revisions, provenance, integrity, freshness, compatibility, scope, conflicts, retention, and availability are checked.	O023	"[""core"",""organ:O023""]"	RELEASE	MANDATORY_RULE	release.package	release.integrity	"[""organ:O023""]"	"{""op"":""always""}"	MUST	EVIDENCE_EVALUATED	REQUIRE	COMPLIANT		[]	600	"{""counterevidence_policy"":""HOLD"",""freshness_requirement"":""CURRENT"",""independence_requirement"":""IND_ANY"",""minimum_epistemic_status"":""S1"",""minimum_evidence_count"":1,""required_source_classes"":[]}"	"[""PACKAGE_INCOMPLETE""]"	"[""PACKAGE_MISMATCH""]"	COMPLIANT	REQUIRE	release.integrity::COMPLIANT	DECLARED_CONFORMING_STATE	"{""exceptions"":[],""hold"":[""PACKAGE_INCOMPLETE""],""stop"":[""PACKAGE_MISMATCH""]}"	"[""B0"",""C0"",""D0"",""E0"",""I0"",""T0"",""V0""]"	"[""DER-JUST-N-O023-03""]"	"[""TC-N-O023-03-NEG"",""TC-N-O023-03-POS"",""TC-POSITIVE-FORMULATION-N-O023-03""]"	"[""CP-01"",""CP-02"",""CP-04"",""CP-05""]"	C03|C07|PACKAGE_BUILD	Required component, version, manifest entry, checksum, compatibility statement, or verification result is incomplete.	"[""REBUILD_COMPONENT"",""REGENERATE_MANIFEST"",""RECALCULATE_HASHES"",""RERUN_FINAL_VERIFICATION""]"	All required components, hashes, compatibility, and verification statuses are recorded.	2.20	UNKNOWN_PRE_V2.18	2.20	v2.21:N-O023-03	eff55886c6e52872598cf10e7877b630f1c050a4128c8d4479792ea2707a2335	30ef5628666181a1fa43c9befbb0856fc9c64ec36e367e99a615816ca3ed2a8d	4ea8a7cbec5223912483d6412145fae4f16e3aab4846f8c10d9be821a8aa8e4a
N-O023-04	BASE	ACTIVE		ACCEPTED_FOR_INTERPRETATION	TRUE	TRUE	FALSE	Succession	All branches are initially new; one successor may be designated as the sole continuator by a separate confirmed transition.	O023	"[""core"",""organ:O023""]"	TRANSITION	MANDATORY_RULE	cycle.transition	transition.validity	"[""organ:O023""]"	"{""op"":""always""}"	MAY	EVIDENCE_EVALUATED	PERMIT	PERMITTED		[]	600	"{""counterevidence_policy"":""HOLD"",""freshness_requirement"":""CURRENT"",""independence_requirement"":""IND_ANY"",""minimum_epistemic_status"":""S1"",""minimum_evidence_count"":1,""required_source_classes"":[]}"	"[""PRECONDITION_PENDING""]"	"[""ILLEGAL_TRANSITION""]"	PERMITTED	PERMIT	transition.validity::PERMITTED	DECLARED_CONFORMING_STATE	"{""exceptions"":[],""hold"":[""PRECONDITION_PENDING""],""stop"":[""ILLEGAL_TRANSITION""]}"	"[""C0"",""E0"",""I0"",""T0"",""V0""]"	"[""DER-JUST-N-O023-04""]"	"[""TC-N-O023-04-NEG"",""TC-N-O023-04-POS"",""TC-POSITIVE-FORMULATION-N-O023-04""]"	"[""CP-03"",""CP-04""]"	C03|C05|C07|RECOVERY	Source, target, trigger, preconditions, invariants, owner, evidence, or rollback is incomplete.	"[""RETURN_TO_SOURCE_STATE"",""RESTORE_INVARIANTS"",""RECALCULATE_ROUTE"",""REPEAT_GATE""]"	The transition record links source, target, trigger, owner, invariants, evidence, and return path.	2.22	UNKNOWN_PRE_V2.18	2.22	v2.21:N-O023-04	74c79904143aa161e3d7a983741f725f529326553d176642e25e6dd622f584f8	c6fdb6110e5222dc05d13474023f91727e6fcc16f8b656f2d3dfd28624900f8b	7b6694d3fd79fa18c1b463fa8e9c40b6fb07a9698f86f4c117d07f7e5a468b05
N-O023-05	BASE	ACTIVE		ACCEPTED_FOR_INTERPRETATION	TRUE	TRUE	FALSE	Two-sided handoff	The current continuator prepares the package, and an external authorized owner confirms the successor; emergency handoff requires a predeclared procedure.	O023	"[""core"",""organ:O023""]"	AUTHORITY	MANDATORY_RULE	agency.authorization	authorization.status	"[""organ:O023""]"	"{""op"":""always""}"	MUST	EVIDENCE_EVALUATED	REQUIRE	COMPLIANT		[]	600	"{""counterevidence_policy"":""HOLD"",""freshness_requirement"":""CURRENT"",""independence_requirement"":""IND_ANY"",""minimum_epistemic_status"":""S1"",""minimum_evidence_count"":1,""required_source_classes"":[]}"	"[""AUTHORITY_PENDING"",""SCOPE_PENDING""]"	"[""UNAUTHORIZED_EXTERNAL_TRANSITION""]"	COMPLIANT	REQUIRE	authorization.status::COMPLIANT	DECLARED_CONFORMING_STATE	"{""exceptions"":[],""hold"":[""AUTHORITY_PENDING"",""SCOPE_PENDING""],""stop"":[""UNAUTHORIZED_EXTERNAL_TRANSITION""]}"	"[""C0"",""E0"",""I0""]"	"[""DER-JUST-N-O023-05""]"	"[""TC-N-O023-05-NEG"",""TC-N-O023-05-POS"",""TC-POSITIVE-FORMULATION-N-O023-05""]"	"[""CP-04""]"	C03|C07|PACKAGE_BUILD|RECOVERY	Actor, scope, delegation, decision owner, or validity evidence is incomplete.	"[""IDENTIFY_AUTHORITY_OWNER"",""OBTAIN_OR_REVOKE_DELEGATION"",""RECALCULATE_SCOPE""]"	A valid authority state, scope, owner, and evidence reference are recorded.	2.22	UNKNOWN_PRE_V2.18	2.22	v2.21:N-O023-05	a31144f43af76a7e4701ce1f870b1c575f03e908d37cdc72e921626f3c9d0186	2e7341c0e301ae71109b912a3d07ddff65ff84f61e1061654a21faabbc8504e5	545c3d9fb7afdb2f424fb5bd75e9a686245d3efa3233523beed54ad5f900e8ba
N-O023-06	BASE	ACTIVE		ACCEPTED_FOR_INTERPRETATION	TRUE	TRUE	FALSE	Clean update	During an update, a new instance receives the physiology archive, and prior working state enters only through an explicit verified migration.	O023	"[""core"",""organ:O023""]"	RELEASE	MANDATORY_RULE	release.package	release.integrity	"[""organ:O023""]"	"{""op"":""always""}"	MUST	EVIDENCE_EVALUATED	REQUIRE	COMPLIANT		[]	600	"{""counterevidence_policy"":""HOLD"",""freshness_requirement"":""CURRENT"",""independence_requirement"":""IND_ANY"",""minimum_epistemic_status"":""S1"",""minimum_evidence_count"":1,""required_source_classes"":[]}"	"[""PACKAGE_INCOMPLETE""]"	"[""PACKAGE_MISMATCH""]"	COMPLIANT	REQUIRE	release.integrity::COMPLIANT	DECLARED_CONFORMING_STATE	"{""exceptions"":[],""hold"":[""PACKAGE_INCOMPLETE""],""stop"":[""PACKAGE_MISMATCH""]}"	"[""B0"",""C0"",""D0"",""E0"",""I0"",""T0"",""V0""]"	"[""DER-JUST-N-O023-06""]"	"[""TC-N-O023-06-NEG"",""TC-N-O023-06-POS"",""TC-POSITIVE-FORMULATION-N-O023-06""]"	"[""CP-01"",""CP-02"",""CP-04"",""CP-05""]"	PACKAGE_BUILD	Required component, version, manifest entry, checksum, compatibility statement, or verification result is incomplete.	"[""REBUILD_COMPONENT"",""REGENERATE_MANIFEST"",""RECALCULATE_HASHES"",""RERUN_FINAL_VERIFICATION""]"	All required components, hashes, compatibility, and verification statuses are recorded.	2.20	UNKNOWN_PRE_V2.18	2.20	v2.21:N-O023-06	8e403fede91c7e47d55d4f6cd74e14aed7ce63c299b64028d7e2186c710a014b	8721e6e66587bb3a09e8f60061e5facdc0e470618d15dcbb2919c21496806fd0	bb995ef57ae8e988b8730047164586a843fa37b30cb54debac08847e2d471ee3
N-O023-07	BASE	ACTIVE		ACCEPTED_FOR_INTERPRETATION	TRUE	TRUE	FALSE	Object ownership	O023 retains accountable ownership of its recovery mode, restored state, verified package, succession record, handoff, and clean-update state; contributing organs supply typed inputs and preserve ownership of their own outputs.	O023	"[""core"",""organ:O023""]"	AUTHORITY	MANDATORY_RULE	agency.authorization	authorization.status	"[""organ:O023""]"	"{""op"":""fact"",""path"":""violation.N-O023-07"",""equals"":true}"	MUST_NOT	KERNEL_COMPUTED	PROHIBIT		VIOLATED	[]	600	"{""counterevidence_policy"":""HOLD"",""freshness_requirement"":""ANY"",""independence_requirement"":""IND_ANY"",""minimum_epistemic_status"":""S0"",""minimum_evidence_count"":0,""required_source_classes"":[]}"	"[""AUTHORITY_PENDING"",""SCOPE_PENDING""]"	"[""UNAUTHORIZED_EXTERNAL_TRANSITION""]"	DECLARED_CONFORMING_STATE	PROHIBIT	authorization.status::DECLARED_CONFORMING_STATE	VIOLATED	"{""exceptions"":[],""hold"":[""AUTHORITY_PENDING"",""SCOPE_PENDING""],""stop"":[""UNAUTHORIZED_EXTERNAL_TRANSITION""]}"	"[""C0"",""E0"",""I0"",""T0"",""V0""]"	"[""DER-JUST-N-O023-07""]"	"[""TC-N-O023-07-NEG"",""TC-N-O023-07-POS"",""TC-POSITIVE-FORMULATION-N-O023-07""]"	"[""CP-04"",""CP-05"",""CP-06""]"	C03|C07|PACKAGE_BUILD|RECOVERY	Actor, scope, delegation, decision owner, or validity evidence is incomplete.	"[""IDENTIFY_AUTHORITY_OWNER"",""OBTAIN_OR_REVOKE_DELEGATION"",""RECALCULATE_SCOPE""]"	A valid authority state, scope, owner, and evidence reference are recorded.	2.22	UNKNOWN_PRE_V2.18	2.22	v2.21:N-O023-07	b317fae938058d7b279b3d34463eeb94d0fea3634ba4d16ad5f1a6f2ed3946d4	85930805918d76d4c6456347cc389fef5f016cbc70b92a73b32735348789a56a	ea8435d9dd0a6e77ec90391fe42eb24410ccfaedd5be22656b55dee286622c67
