norm_id	layer	card_status	candidate_kind	acceptance_status	available_for_evaluation	available_for_application	operator_activation_required	title	formulation	owner	scope	profile_id	norm_type	semantic_target	predicate	trigger	when	modality	execution_mode	operation	desired_value	forbidden_value	exceptions	priority	evidence_requirements	hold	stop	target_state	target_transition	success_criterion	forbidden_state	boundary_conditions	foundations	derivation_refs	tests	principles	required_phase	defect_signal	repair_path	closure_criterion	last_semantic_change_version	last_formulation_change_version	last_machine_semantics_change_version	predecessor_ref	formulation_sha256	semantic_payload_sha256	structural_card_sha256
N-GEN-087	BASE	ACTIVE		ACCEPTED_FOR_INTERPRETATION	TRUE	TRUE	FALSE	Passive declarative distribution	BOIS operation relies on passive readable package data and host-provided operations; development tools remain outside the loading artifact.	O025	"[""core"",""all_substrates""]"	RELEASE	INVARIANT	release.package	package.executable_dependency	"[""load:*"",""release:package""]"	"{""op"":""always""}"	MUST_NOT	KERNEL_INTERPRETED	PROHIBIT		EXECUTABLE_DEPENDENCY	[]	1000	"{""counterevidence_policy"":""HOLD"",""freshness_requirement"":""ANY"",""independence_requirement"":""IND_ANY"",""minimum_epistemic_status"":""S0"",""minimum_evidence_count"":0,""required_source_classes"":[]}"	"[""HOLD-CONTEXT-INCOMPLETE""]"	"[""STOP-BASE-INVARIANT""]"	DECLARED_CONFORMING_STATE	PROHIBIT	package.executable_dependency::DECLARED_CONFORMING_STATE	EXECUTABLE_DEPENDENCY	"{""exceptions"":[],""hold"":[""HOLD-CONTEXT-INCOMPLETE""],""stop"":[""STOP-BASE-INVARIANT""]}"	"[""B0"",""C0"",""E0"",""I0""]"	"[""DER-JUST-N-GEN-087""]"	"[""TC-N-GEN-087-NEG"",""TC-N-GEN-087-POS"",""TC-POSITIVE-FORMULATION-N-GEN-087""]"	"[""CP-01"",""CP-04""]"	C03|C07|PACKAGE_BUILD|PACKAGE_LOAD	Required component, version, manifest entry, checksum, compatibility statement, or verification result is incomplete.	"[""REBUILD_COMPONENT"",""REGENERATE_MANIFEST"",""RECALCULATE_HASHES"",""RERUN_FINAL_VERIFICATION""]"	All required components, hashes, compatibility, and verification statuses are recorded.	2.22	UNKNOWN_PRE_V2.18	2.22	v2.21:N-GEN-087	f2bb7bb8041ff2226baec5ea870f9a2a593c4f1384cd9ab19a6f660805997725	778acc3c5ec0f7dc5975db56c11aa118d27d0888286748d8b119b4c39055519c	88569fe654ce714d6dca0503903177be476b850157db459b994f2f300ae8d98f
N-GEN-088	BASE	ACTIVE		ACCEPTED_FOR_INTERPRETATION	TRUE	TRUE	FALSE	Reference minimum is front-loaded	The first pages of each physiological PDF state document identity, layer, version, source precedence, loading protocol, activation boundary, required companion document, and failure behavior.	O025	"[""core"",""all_substrates""]"	RELEASE	MANDATORY_RULE	release.document	bootstrap.visibility	"[""load:*""]"	"{""op"":""always""}"	MUST	DECLARATIVE_AUDIT	REQUIRE	FRONT_LOADED_BOOTSTRAP		[]	900	"{""counterevidence_policy"":""HOLD"",""freshness_requirement"":""ANY"",""independence_requirement"":""IND_ANY"",""minimum_epistemic_status"":""S0"",""minimum_evidence_count"":0,""required_source_classes"":[]}"	"[""HOLD-CONTEXT-INCOMPLETE""]"	"[""STOP-BASE-INVARIANT""]"	FRONT_LOADED_BOOTSTRAP	REQUIRE	bootstrap.visibility::FRONT_LOADED_BOOTSTRAP	DECLARED_CONFORMING_STATE	"{""exceptions"":[],""hold"":[""HOLD-CONTEXT-INCOMPLETE""],""stop"":[""STOP-BASE-INVARIANT""]}"	"[""B0"",""C0"",""E0"",""I0"",""T0""]"	"[""DER-JUST-N-GEN-088""]"	"[""TC-N-GEN-088-NEG"",""TC-N-GEN-088-POS"",""TC-POSITIVE-FORMULATION-N-GEN-088""]"	"[""CP-01"",""CP-05""]"	PACKAGE_LOAD|PACKAGE_BUILD|C03|C05|C07	Required component, version, manifest entry, checksum, compatibility statement, or verification result is incomplete.	"[""REBUILD_COMPONENT"",""REGENERATE_MANIFEST"",""RECALCULATE_HASHES"",""RERUN_FINAL_VERIFICATION""]"	All required components, hashes, compatibility, and verification statuses are recorded.	2.22	UNKNOWN_PRE_V2.18	2.22	v2.21:N-GEN-088	3cbbe2ab6f2f99e453331b24101bc734b209825efc27ef7db62c72e9cfd2c11e	6cf3fcedd272ece29eb17b0fe736645349eafa200dfa06501f500901f53c298d	fa167218c929fee7aa13e14b700616a4414b98167b98fe12239455fa8f6c3995
N-GEN-089	BASE	ACTIVE		ACCEPTED_FOR_INTERPRETATION	TRUE	TRUE	FALSE	One canonical English pair	An interpreter loads the English Base Core and English Personal Layer as one canonical pair; explanatory translations remain output surfaces with zero normative identity and zero catalog-count contribution.	O012	"[""core"",""all_substrates""]"	SURFACE	MANDATORY_RULE	language.surface	language.active_pair	"[""load:*""]"	"{""op"":""always""}"	MUST	KERNEL_INTERPRETED	REQUIRE	ONE_LANGUAGE_PAIR		[]	900	"{""counterevidence_policy"":""HOLD"",""freshness_requirement"":""ANY"",""independence_requirement"":""IND_ANY"",""minimum_epistemic_status"":""S0"",""minimum_evidence_count"":0,""required_source_classes"":[]}"	"[""HOLD-CONTEXT-INCOMPLETE""]"	"[""STOP-BASE-INVARIANT""]"	ONE_LANGUAGE_PAIR	REQUIRE	language.active_pair::ONE_LANGUAGE_PAIR	DECLARED_CONFORMING_STATE	"{""exceptions"":[],""hold"":[""HOLD-CONTEXT-INCOMPLETE""],""stop"":[""STOP-BASE-INVARIANT""]}"	"[""C0"",""E0"",""I0"",""T0""]"	"[""DER-JUST-N-GEN-089""]"	"[""TC-N-GEN-089-NEG"",""TC-N-GEN-089-POS"",""TC-POSITIVE-FORMULATION-N-GEN-089""]"	"[""CP-04"",""CP-05""]"	C05|C08|PACKAGE_BUILD|PACKAGE_LOAD	Meaning, identifier, language boundary, required block, or readability condition is missing.	"[""RESTORE_REQUIRED_CONTENT"",""SIMPLIFY_LAYOUT"",""PRESERVE_CANONICAL_IDENTIFIER"",""RERENDER_AND_REVIEW""]"	The surface preserves the canonical meaning, boundary, identifiers, and required visible fields.	2.22	UNKNOWN_PRE_V2.18	2.22	v2.21:N-GEN-089	98e765006e093936b737ec99df8fb755db923058c40b45bd2f833aa99a54aaab	8886caa64b429e5306a71ab384aa45e0785ecc4e9ef71d9723fd7b3141e7f3d1	c3b33df06071dd1620c41d8655f0e5cd7bd1548c0c057042afcfc60ef4224552
N-GEN-090	BASE	ACTIVE		ACCEPTED_FOR_INTERPRETATION	TRUE	TRUE	FALSE	Human-readable compiler route	The package provides a complete route from definitions and foundations through typed justification, canonical norms, behavioral profiles, objects, cycle gates, tests, scenarios, reconstruction, verification, repair, and bounded application.	O007	"[""core"",""all_substrates""]"	TRANSITION	MANDATORY_RULE	compiler.route	route.completeness	"[""compile:doctrine""]"	"{""op"":""always""}"	MUST	KERNEL_INTERPRETED	REQUIRE	HUMAN_READABLE_COMPILER_ROUTE		[]	900	"{""counterevidence_policy"":""HOLD"",""freshness_requirement"":""ANY"",""independence_requirement"":""IND_ANY"",""minimum_epistemic_status"":""S0"",""minimum_evidence_count"":0,""required_source_classes"":[]}"	"[""HOLD-CONTEXT-INCOMPLETE""]"	"[""STOP-BASE-INVARIANT""]"	HUMAN_READABLE_COMPILER_ROUTE	REQUIRE	route.completeness::HUMAN_READABLE_COMPILER_ROUTE	DECLARED_CONFORMING_STATE	"{""exceptions"":[],""hold"":[""HOLD-CONTEXT-INCOMPLETE""],""stop"":[""STOP-BASE-INVARIANT""]}"	"[""C0"",""E0"",""I0"",""T0"",""V0""]"	"[""DER-JUST-N-GEN-090""]"	"[""TC-N-GEN-090-NEG"",""TC-N-GEN-090-POS"",""TC-POSITIVE-FORMULATION-N-GEN-090""]"	"[""CP-03"",""CP-04"",""CP-05""]"	C03|C05|C07|C08|PACKAGE_BUILD	Source, target, trigger, preconditions, invariants, owner, evidence, or rollback is incomplete.	"[""RETURN_TO_SOURCE_STATE"",""RESTORE_INVARIANTS"",""RECALCULATE_ROUTE"",""REPEAT_GATE""]"	The transition record links source, target, trigger, owner, invariants, evidence, and return path.	2.22	UNKNOWN_PRE_V2.18	2.22	v2.21:N-GEN-090	0c5601c96ddc1e3208f3ec1c19c95564315c61bd44acaa97a56f3fb1fdbf1c8c	8b5872943341d98669e2cb866079fc3dd389781638e44cb564adf3601fec1ae9	2d12414e7d65c360f36a0a541f279d8e3ae15998db12aaa3e4e90e711cfcb4c9
N-GEN-091	BASE	ACTIVE		ACCEPTED_FOR_INTERPRETATION	TRUE	TRUE	FALSE	Explicit reconstruction attestation and truthful state	A reconstruction attestation initiated by an explicit operator request reports catalog counts, statuses, reproducible hashes, omissions, scenario results, host-policy boundary, and authorization state while preserving attachment, reconstruction, applicability, acceptance, and authorization as separate states.	O027	"[""core"",""all_substrates""]"	RELEASE	MANDATORY_RULE	load.self_test	load.status	"[""load:*""]"	"{""op"":""always""}"	MUST	KERNEL_INTERPRETED	REQUIRE	TRUTHFUL_READY_HOLD_FAIL		[]	900	"{""counterevidence_policy"":""HOLD"",""freshness_requirement"":""ANY"",""independence_requirement"":""IND_ANY"",""minimum_epistemic_status"":""S0"",""minimum_evidence_count"":0,""required_source_classes"":[]}"	"[""HOLD-CONTEXT-INCOMPLETE""]"	"[""STOP-BASE-INVARIANT""]"	TRUTHFUL_READY_HOLD_FAIL	REQUIRE	load.status::TRUTHFUL_READY_HOLD_FAIL	DECLARED_CONFORMING_STATE	"{""exceptions"":[],""hold"":[""HOLD-CONTEXT-INCOMPLETE""],""stop"":[""STOP-BASE-INVARIANT""]}"	"[""C0"",""E0"",""I0"",""T0""]"	"[""DER-JUST-N-GEN-091""]"	"[""TC-ACCEPTANCE-PASSPORT-COMPLETE"",""TC-ACCEPTANCE-SILENT-OMISSION"",""TC-N-GEN-091-NEG"",""TC-N-GEN-091-POS"",""TC-POSITIVE-FORMULATION-N-GEN-091""]"	"[""CP-04"",""CP-05""]"	C08|PACKAGE_BUILD|EXTERNAL_ACTION	Required component, version, manifest entry, checksum, compatibility statement, or verification result is incomplete.	"[""REBUILD_COMPONENT"",""REGENERATE_MANIFEST"",""RECALCULATE_HASHES"",""RERUN_FINAL_VERIFICATION""]"	All required components, hashes, compatibility, and verification statuses are recorded.	2.22	UNKNOWN_PRE_V2.18	2.22	v2.21:N-GEN-091	89f735464fd366beb5e93e8aaac9450f2729033a4e6e931ef19837e3136f812a	9e789f91020d6a7df0cbeaaed542ce767ad38a9c1093cbb2ec1cad228a2bb152	b3ad09ec7acc57e84444d6c2277e99f3f4cb955d691cce2f646cbb7c2d3966c2
N-GEN-092	BASE	ACTIVE		ACCEPTED_FOR_INTERPRETATION	TRUE	TRUE	FALSE	Reference appendices remain non-normative by default	ODT sources, unselected translations, QA reports, explanatory appendices, and historical materials remain reference surfaces; active normative status arises through the canonical change procedure.	O014	"[""core"",""all_substrates""]"	RELEASE	MANDATORY_RULE	reference.surface	activation.status	"[""load:*""]"	"{""op"":""always""}"	MUST_NOT	KERNEL_INTERPRETED	PROHIBIT		REFERENCE_AUTO_ACTIVATION	[]	900	"{""counterevidence_policy"":""HOLD"",""freshness_requirement"":""ANY"",""independence_requirement"":""IND_ANY"",""minimum_epistemic_status"":""S0"",""minimum_evidence_count"":0,""required_source_classes"":[]}"	"[""HOLD-CONTEXT-INCOMPLETE""]"	"[""STOP-BASE-INVARIANT""]"	DECLARED_CONFORMING_STATE	PROHIBIT	activation.status::DECLARED_CONFORMING_STATE	REFERENCE_AUTO_ACTIVATION	"{""exceptions"":[],""hold"":[""HOLD-CONTEXT-INCOMPLETE""],""stop"":[""STOP-BASE-INVARIANT""]}"	"[""C0"",""E0"",""I0"",""T0""]"	"[""DER-JUST-N-GEN-092""]"	"[""TC-N-GEN-092-NEG"",""TC-N-GEN-092-POS"",""TC-POSITIVE-FORMULATION-N-GEN-092""]"	"[""CP-04"",""CP-05""]"	C03|C05|C07	Required component, version, manifest entry, checksum, compatibility statement, or verification result is incomplete.	"[""REBUILD_COMPONENT"",""REGENERATE_MANIFEST"",""RECALCULATE_HASHES"",""RERUN_FINAL_VERIFICATION""]"	All required components, hashes, compatibility, and verification statuses are recorded.	2.22	UNKNOWN_PRE_V2.18	2.22	v2.21:N-GEN-092	35d7552cbc7d13e4487300a4cdaba6c3a94ebf6092a21921fc67d00c2daf3ff6	e04955e1110a7efbaa32fdb902c53f5d7cfe58ceb04a4e343255baa86ed98011	b2b49a8a077754c9bc5a1561135c5983982a677d02ba003919dc32db06027f6c
N-GEN-093	BASE	ACTIVE		ACCEPTED_FOR_INTERPRETATION	TRUE	TRUE	FALSE	Typed dimensions of rule acceptance	Rule acceptance is recorded on separate typed axes for canonical inclusion, reconstruction, availability for application, route applicability, operator acceptance, runtime authorization, and external-action authority.	O025	"[""core"",""all_substrates""]"	AUTHORITY	MANDATORY_RULE	rule.acceptance.axes	acceptance.status_separation	"[""load:*"",""rule_change"",""version_release""]"	"{""op"":""always""}"	MUST	KERNEL_INTERPRETED	REQUIRE	COMPLETE_TYPED_ACCEPTANCE	SILENT_OMISSION_OR_STATUS_CONFLATION	[]	930	"{""counterevidence_policy"":""HOLD"",""freshness_requirement"":""CURRENT_RELEASE"",""independence_requirement"":""IND_ANY"",""minimum_epistemic_status"":""S0"",""minimum_evidence_count"":0,""required_source_classes"":[]}"	"[""HOLD-RULE-ACCEPTANCE-INCOMPLETE""]"	"[""STOP-RULE-ACCEPTANCE-OMISSION""]"	COMPLETE_TYPED_ACCEPTANCE	REQUIRE	acceptance.status_separation::COMPLETE_TYPED_ACCEPTANCE	SILENT_OMISSION_OR_STATUS_CONFLATION	"{""exceptions"":[],""hold"":[""HOLD-RULE-ACCEPTANCE-INCOMPLETE""],""stop"":[""STOP-RULE-ACCEPTANCE-OMISSION""]}"	"[""C0"",""E0"",""I0"",""T0""]"	"[""DER-JUST-N-GEN-093""]"	"[""TC-ACCEPTANCE-AXES-SEPARATE"",""TC-N-GEN-093-NEG"",""TC-N-GEN-093-POS"",""TC-POSITIVE-FORMULATION-N-GEN-093""]"	"[""CP-04"",""CP-05""]"	C03|C05|C07|C08|PACKAGE_LOAD|EXTERNAL_ACTION	Actor, scope, delegation, decision owner, or validity evidence is incomplete.	"[""IDENTIFY_AUTHORITY_OWNER"",""OBTAIN_OR_REVOKE_DELEGATION"",""RECALCULATE_SCOPE""]"	A valid authority state, scope, owner, and evidence reference are recorded.	2.22	UNKNOWN_PRE_V2.18	2.22	v2.21:N-GEN-093	642dc6aee65b303674146499a0674dbc08e6c5994ad4cabf1a8e633262626721	41aa4417b0dc3f1c72793c9153c859d359effcf37d5b176d4acd9174c763b951	a25be6c3918a192b0edcf43e57e4c3e485d77f1833e8b294cde6c88f2e183160
N-GEN-094	BASE	ACTIVE		ACCEPTED_FOR_INTERPRETATION	TRUE	TRUE	FALSE	Complete rule-reconstruction matrix	The reconstruction matrix contains exactly one row for every canonical rule and records layer, ACTIVE or CANDIDATE status, section, formulation hash, semantic hash, availability for application, and the boundaries of applicability, operator acceptance, and action authorization.	O027	"[""core"",""all_substrates""]"	AUTHORITY	MANDATORY_RULE	load.rule_acceptance_matrix	acceptance.matrix_completeness	"[""load:*"",""rule_change"",""version_release""]"	"{""op"":""always""}"	MUST	KERNEL_INTERPRETED	REQUIRE	COMPLETE_TYPED_ACCEPTANCE	SILENT_OMISSION_OR_STATUS_CONFLATION	[]	930	"{""counterevidence_policy"":""HOLD"",""freshness_requirement"":""CURRENT_RELEASE"",""independence_requirement"":""IND_ANY"",""minimum_epistemic_status"":""S0"",""minimum_evidence_count"":0,""required_source_classes"":[]}"	"[""HOLD-RULE-ACCEPTANCE-INCOMPLETE""]"	"[""STOP-RULE-ACCEPTANCE-OMISSION""]"	COMPLETE_TYPED_ACCEPTANCE	REQUIRE	acceptance.matrix_completeness::COMPLETE_TYPED_ACCEPTANCE	SILENT_OMISSION_OR_STATUS_CONFLATION	"{""exceptions"":[],""hold"":[""HOLD-RULE-ACCEPTANCE-INCOMPLETE""],""stop"":[""STOP-RULE-ACCEPTANCE-OMISSION""]}"	"[""C0"",""E0"",""I0"",""T0""]"	"[""DER-JUST-N-GEN-094""]"	"[""TC-ACCEPTANCE-CURRENT-CATALOG"",""TC-N-GEN-094-NEG"",""TC-N-GEN-094-POS"",""TC-POSITIVE-FORMULATION-N-GEN-094""]"	"[""CP-04"",""CP-05""]"	C03|C07|C08|PACKAGE_BUILD|EXTERNAL_ACTION	Actor, scope, delegation, decision owner, or validity evidence is incomplete.	"[""IDENTIFY_AUTHORITY_OWNER"",""OBTAIN_OR_REVOKE_DELEGATION"",""RECALCULATE_SCOPE""]"	A valid authority state, scope, owner, and evidence reference are recorded.	2.22	UNKNOWN_PRE_V2.18	2.22	v2.21:N-GEN-094	1fe0ab6e3e2ce19cca327e7b329772ff118e07c081e05315c797ed0e786bbc06	939e57ae315c061c46e0319f037ec0e6138b26eb1d286fdd8e1e0415a5a04cd7	7c1085348f744f520db0e9654ec97cce4b6608f9dde68ac09cfb722ca5ba38e0
N-GEN-095	BASE	ACTIVE		ACCEPTED_FOR_INTERPRETATION	TRUE	TRUE	FALSE	Complete disposition of predecessor rules	Every rule from a declared predecessor source receives one explicit disposition that records its current relation, owner, scope, semantic effect, evidence, and verification status.	O025	"[""core"",""all_substrates""]"	EVIDENCE	MANDATORY_RULE	lineage.source_rule_disposition	source_acceptance.completeness	"[""load:*"",""rule_change"",""version_release""]"	"{""op"":""always""}"	MUST	KERNEL_INTERPRETED	REQUIRE	COMPLETE_TYPED_ACCEPTANCE	SILENT_OMISSION_OR_STATUS_CONFLATION	[]	930	"{""counterevidence_policy"":""HOLD"",""freshness_requirement"":""CURRENT_RELEASE"",""independence_requirement"":""IND_ANY"",""minimum_epistemic_status"":""S0"",""minimum_evidence_count"":0,""required_source_classes"":[]}"	"[""HOLD-RULE-ACCEPTANCE-INCOMPLETE""]"	"[""STOP-RULE-ACCEPTANCE-OMISSION""]"	COMPLETE_TYPED_ACCEPTANCE	REQUIRE	source_acceptance.completeness::COMPLETE_TYPED_ACCEPTANCE	SILENT_OMISSION_OR_STATUS_CONFLATION	"{""exceptions"":[],""hold"":[""HOLD-RULE-ACCEPTANCE-INCOMPLETE""],""stop"":[""STOP-RULE-ACCEPTANCE-OMISSION""]}"	"[""C0"",""E0"",""I0"",""T0""]"	"[""DER-JUST-N-GEN-095""]"	"[""TC-ACCEPTANCE-CATALOG-COMPLETENESS"",""TC-N-GEN-095-NEG"",""TC-N-GEN-095-POS"",""TC-POSITIVE-FORMULATION-N-GEN-095""]"	"[""CP-04"",""CP-05""]"	C03|C07|EXTERNAL_ACTION	Source, provenance, scope, counterevidence, alternatives, or confidence boundary is incomplete.	"[""REBUILD_PROVENANCE"",""ADD_COUNTEREVIDENCE_CHECK"",""LOWER_CONFIDENCE"",""REOPEN_HYPOTHESIS""]"	The claim status, evidence, counterevidence, scope, and review conditions are recorded.	2.20	UNKNOWN_PRE_V2.18	2.20	v2.21:N-GEN-095	6f42626114361404a4914ee4893ee78948f6d317a3978aea8b8d4fc14fcbdcb6	81d0fd32b6878ba3323532a4e908acf5a5cbd1beec04d83a769ea20e3187ae56	6b856b45919fe3ed4afed221f080962d4d1c558b05268bdcb7eec449923bf567
N-GEN-096	BASE	ACTIVE		ACCEPTED_FOR_INTERPRETATION	TRUE	TRUE	FALSE	Reconstruction omission HOLD and repair	A reconstruction attestation reaches PASS after every canonical rule has exactly one status-preserving row, all hashes match, and all catalog-identity mutations are detected and repaired.	O027	"[""core"",""all_substrates""]"	AUTHORITY	MANDATORY_RULE	load.acceptance_self_test	acceptance.self_test_result	"[""load:*"",""rule_change"",""version_release""]"	"{""op"":""always""}"	MUST	KERNEL_INTERPRETED	REQUIRE	COMPLETE_TYPED_ACCEPTANCE	SILENT_OMISSION_OR_STATUS_CONFLATION	[]	930	"{""counterevidence_policy"":""HOLD"",""freshness_requirement"":""CURRENT_RELEASE"",""independence_requirement"":""IND_ANY"",""minimum_epistemic_status"":""S0"",""minimum_evidence_count"":0,""required_source_classes"":[]}"	"[""HOLD-RULE-ACCEPTANCE-INCOMPLETE""]"	"[""STOP-RULE-ACCEPTANCE-OMISSION""]"	COMPLETE_TYPED_ACCEPTANCE	REQUIRE	acceptance.self_test_result::COMPLETE_TYPED_ACCEPTANCE	SILENT_OMISSION_OR_STATUS_CONFLATION	"{""exceptions"":[],""hold"":[""HOLD-RULE-ACCEPTANCE-INCOMPLETE""],""stop"":[""STOP-RULE-ACCEPTANCE-OMISSION""]}"	"[""C0"",""E0"",""I0"",""T0""]"	"[""DER-JUST-N-GEN-096""]"	"[""TC-ACCEPTANCE-CANDIDATE-NONACTIVATION"",""TC-ACCEPTANCE-OMISSION-MUTATION"",""TC-N-GEN-096-NEG"",""TC-N-GEN-096-POS"",""TC-POSITIVE-FORMULATION-N-GEN-096""]"	"[""CP-04"",""CP-05""]"	C03|C07|PACKAGE_BUILD	Actor, scope, delegation, decision owner, or validity evidence is incomplete.	"[""IDENTIFY_AUTHORITY_OWNER"",""OBTAIN_OR_REVOKE_DELEGATION"",""RECALCULATE_SCOPE""]"	A valid authority state, scope, owner, and evidence reference are recorded.	2.22	UNKNOWN_PRE_V2.18	2.22	v2.21:N-GEN-096	ce0458e4d88cd1fd191d2792875fff7aa01931274caf4f77bfa359eefc80ddb1	51839a2f04dc889858c9579b50d928b2d388b64d64d71103aeec478fd77c9a64	b685168dbf4875e31b519be2d9160a539bedb1c86eca9934181484057b8b4259
N-GEN-097	BASE	ACTIVE		ACCEPTED_FOR_INTERPRETATION	TRUE	TRUE	FALSE	Positive normative core of every primary formulation	Each primary rule formulation states a target state, a permitted transition, or a positive success criterion. Counterstates, boundaries, exceptions, HOLD, STOP, defects, and negative tests occupy their dedicated card fields.	O025	"[""core"",""all_cycles""]"	SURFACE	MANDATORY_RULE	norm.primary_formulation	formulation.positive_target	"[""rule_create"",""rule_change"",""version_release""]"	"{""op"":""always""}"	MUST	EVIDENCE_EVALUATED	REQUIRE	POSITIVE_TARGET_DECLARED	TARGET_UNDEFINED	[]	935	"{""counterevidence_policy"":""HOLD"",""freshness_requirement"":""CURRENT_RELEASE"",""independence_requirement"":""IND1"",""minimum_epistemic_status"":""S1"",""minimum_evidence_count"":1,""required_source_classes"":[""CANONICAL_RULE_CARD""]}"	"[""HOLD-POSITIVE-FORMULATION-INCOMPLETE""]"	"[""STOP-NORMATIVE-TARGET-UNDEFINED""]"	POSITIVE_TARGET_DECLARED	REQUIRE	formulation.positive_target::POSITIVE_TARGET_DECLARED	TARGET_UNDEFINED	"{""exceptions"":[],""hold"":[""HOLD-POSITIVE-FORMULATION-INCOMPLETE""],""stop"":[""STOP-NORMATIVE-TARGET-UNDEFINED""]}"	"[""C0"",""E0"",""I0"",""T0""]"	"[""DER-JUST-N-GEN-097""]"	"[""TC-N-GEN-097-NEG"",""TC-N-GEN-097-POS"",""TC-POSITIVE-CANONICAL-SURFACE-EQUIVALENCE"",""TC-POSITIVE-FORMULATION-N-GEN-097"",""TC-POSITIVE-NORMATIVE-CORE-ALL""]"	"[""CP-04"",""CP-05""]"	PACKAGE_BUILD	Meaning, identifier, language boundary, required block, or readability condition is missing.	"[""RESTORE_REQUIRED_CONTENT"",""SIMPLIFY_LAYOUT"",""PRESERVE_CANONICAL_IDENTIFIER"",""RERENDER_AND_REVIEW""]"	The surface preserves the canonical meaning, boundary, identifiers, and required visible fields.	2.20	UNKNOWN_PRE_V2.18	2.20	v2.21:N-GEN-097	9d2ed4ac907d36f85c79789580d8124ba903f7a16e0aa92b4e04ee996c419022	1e8b0f2fa024d88546c0358a24403e53f0b5ab3c67b722afb2a08a52f3e024b9	9ad70dfb1573df42035546e3150c46d08430cd0362da09343075548fe5cb417c
N-O001-01	BASE	ACTIVE		ACCEPTED_FOR_INTERPRETATION	TRUE	TRUE	FALSE	Input literalness	The primary record preserves received content, channel, and constraints exactly, while inferred intent and truth status remain separate typed assessments.	O001	"[""core"",""organ:O001""]"	EVIDENCE	MANDATORY_RULE	epistemic.claim	epistemic.status	"[""organ:O001""]"	"{""op"":""always""}"	MUST	EVIDENCE_EVALUATED	REQUIRE	COMPLIANT		[]	600	"{""counterevidence_policy"":""HOLD"",""freshness_requirement"":""CURRENT"",""independence_requirement"":""IND_ANY"",""minimum_epistemic_status"":""S1"",""minimum_evidence_count"":1,""required_source_classes"":[]}"	"[""MISSING_EVIDENCE"",""UNRESOLVED_COUNTEREVIDENCE""]"	"[""EVIDENCE_FABRICATION""]"	COMPLIANT	REQUIRE	epistemic.status::COMPLIANT	DECLARED_CONFORMING_STATE	"{""exceptions"":[],""hold"":[""MISSING_EVIDENCE"",""UNRESOLVED_COUNTEREVIDENCE""],""stop"":[""EVIDENCE_FABRICATION""]}"	"[""B0"",""C0"",""E0"",""I0""]"	"[""DER-JUST-N-O001-01""]"	"[""TC-N-O001-01-NEG"",""TC-N-O001-01-POS"",""TC-POSITIVE-FORMULATION-N-O001-01""]"	"[""CP-01""]"	C00	Source, provenance, scope, counterevidence, alternatives, or confidence boundary is incomplete.	"[""REBUILD_PROVENANCE"",""ADD_COUNTEREVIDENCE_CHECK"",""LOWER_CONFIDENCE"",""REOPEN_HYPOTHESIS""]"	The claim status, evidence, counterevidence, scope, and review conditions are recorded.	2.22	UNKNOWN_PRE_V2.18	2.22	v2.21:N-O001-01	547fa8e508ea47e88e6466c3c0e01c8eb28ce871f4503130d4e2ff78a473fcca	c0d8bdeb80d5f0a0410e15bff86f347cf0de4541d858342ebf0fecabbf575f77	ef3d9df67bc262f4a7af422477132a253ddeb63b98e749920e91ef3a64a9504d
N-O001-02	BASE	ACTIVE		ACCEPTED_FOR_INTERPRETATION	TRUE	TRUE	FALSE	Multiplicity of phenomena	A single input container may produce several independent phenomena with their own identifiers, boundaries, and risks.	O001	"[""core"",""organ:O001""]"	SAFETY	MANDATORY_RULE	risk.transition_control	risk.status	"[""organ:O001""]"	"{""op"":""always""}"	MAY	EVIDENCE_EVALUATED	PERMIT	PERMITTED		[]	600	"{""counterevidence_policy"":""HOLD"",""freshness_requirement"":""CURRENT"",""independence_requirement"":""IND_ANY"",""minimum_epistemic_status"":""S1"",""minimum_evidence_count"":1,""required_source_classes"":[]}"	"[""RISK_UNRESOLVED""]"	"[""UNAUTHORIZED_IRREVERSIBLE_TRANSITION"",""HIGH_RISK_WITHOUT_HUMAN_PROCEDURE""]"	PERMITTED	PERMIT	risk.status::PERMITTED	DECLARED_CONFORMING_STATE	"{""exceptions"":[],""hold"":[""RISK_UNRESOLVED""],""stop"":[""UNAUTHORIZED_IRREVERSIBLE_TRANSITION"",""HIGH_RISK_WITHOUT_HUMAN_PROCEDURE""]}"	"[""C0"",""E0"",""I0"",""T0"",""V0""]"	"[""DER-JUST-N-O001-02""]"	"[""TC-N-O001-02-NEG"",""TC-N-O001-02-POS"",""TC-POSITIVE-FORMULATION-N-O001-02""]"	"[""CP-04"",""CP-06""]"	C00|C01	Risk class, affected objects, reversibility, authority, compensation, or residual-risk owner is incomplete.	"[""CLASSIFY_RISK"",""ADD_ROLLBACK_OR_COMPENSATION"",""OBTAIN_RISK_ACCEPTANCE"",""REDUCE_SCOPE""]"	Risk, reversibility, residual risk, owner, and rollback or compensation are recorded.	2.22	UNKNOWN_PRE_V2.18	2.22	v2.21:N-O001-02	7079c314740ab3f657b02273c40105f871e7201191471b1e7f1c631028d78a85	58f6ab716f4cd8e236ada2f41d96e6ab20db1385152f6d2fe6e8838e67104750	11be63bcfecfc8688f9f72b576c0a02ed79fd8ffe15721dd9e36040e6380ce05
N-O001-03	BASE	ACTIVE		ACCEPTED_FOR_INTERPRETATION	TRUE	TRUE	FALSE	Phenomenon type	Each phenomenon is classified as external, epistemic, substrate-related, interactional, or composite with separate components.	O001	"[""core"",""organ:O001""]"	EVIDENCE	MANDATORY_RULE	epistemic.claim	epistemic.status	"[""organ:O001""]"	"{""op"":""always""}"	MUST	EVIDENCE_EVALUATED	REQUIRE	COMPLIANT		[]	600	"{""counterevidence_policy"":""HOLD"",""freshness_requirement"":""CURRENT"",""independence_requirement"":""IND_ANY"",""minimum_epistemic_status"":""S1"",""minimum_evidence_count"":1,""required_source_classes"":[]}"	"[""MISSING_EVIDENCE"",""UNRESOLVED_COUNTEREVIDENCE""]"	"[""EVIDENCE_FABRICATION""]"	COMPLIANT	REQUIRE	epistemic.status::COMPLIANT	DECLARED_CONFORMING_STATE	"{""exceptions"":[],""hold"":[""MISSING_EVIDENCE"",""UNRESOLVED_COUNTEREVIDENCE""],""stop"":[""EVIDENCE_FABRICATION""]}"	"[""B0"",""C0"",""E0"",""I0"",""T0"",""V0""]"	"[""DER-JUST-N-O001-03""]"	"[""TC-N-O001-03-NEG"",""TC-N-O001-03-POS"",""TC-POSITIVE-FORMULATION-N-O001-03""]"	"[""CP-01"",""CP-03"",""CP-04""]"	C00|C03|C07	Source, provenance, scope, counterevidence, alternatives, or confidence boundary is incomplete.	"[""REBUILD_PROVENANCE"",""ADD_COUNTEREVIDENCE_CHECK"",""LOWER_CONFIDENCE"",""REOPEN_HYPOTHESIS""]"	The claim status, evidence, counterevidence, scope, and review conditions are recorded.	2.22	UNKNOWN_PRE_V2.18	2.22	v2.21:N-O001-03	35b4149e1e1b4a80b91b3f136d6024b6789f438e23f1666314220fee176c598e	62d34d3b8f4099188db2ec5e6d7b0a04d5401cf7456324ce279de7a82af140ca	7158c3db3f9c5c68bcfc0e8973956d2df3e9fc7df2442c7ea6a5ba6a8a4d6f22
