norm_id	layer	card_status	candidate_kind	acceptance_status	available_for_evaluation	available_for_application	operator_activation_required	title	formulation	owner	scope	profile_id	norm_type	semantic_target	predicate	trigger	when	modality	execution_mode	operation	desired_value	forbidden_value	exceptions	priority	evidence_requirements	hold	stop	target_state	target_transition	success_criterion	forbidden_state	boundary_conditions	foundations	derivation_refs	tests	principles	required_phase	defect_signal	repair_path	closure_criterion	last_semantic_change_version	last_formulation_change_version	last_machine_semantics_change_version	predecessor_ref	formulation_sha256	semantic_payload_sha256	structural_card_sha256
N-O010-07	BASE	ACTIVE		ACCEPTED_FOR_INTERPRETATION	TRUE	TRUE	FALSE	Object ownership	O010 retains accountable ownership of its message evidence, document evidence, computation evidence, negative evidence, and scoped fact; contributing organs supply typed inputs and preserve ownership of their own outputs.	O010	"[""core"",""organ:O010""]"	AUTHORITY	MANDATORY_RULE	agency.authorization	authorization.status	"[""organ:O010""]"	"{""op"":""fact"",""path"":""violation.N-O010-07"",""equals"":true}"	MUST_NOT	KERNEL_COMPUTED	PROHIBIT		VIOLATED	[]	600	"{""counterevidence_policy"":""HOLD"",""freshness_requirement"":""ANY"",""independence_requirement"":""IND_ANY"",""minimum_epistemic_status"":""S0"",""minimum_evidence_count"":0,""required_source_classes"":[]}"	"[""AUTHORITY_PENDING"",""SCOPE_PENDING""]"	"[""UNAUTHORIZED_EXTERNAL_TRANSITION""]"	DECLARED_CONFORMING_STATE	PROHIBIT	authorization.status::DECLARED_CONFORMING_STATE	VIOLATED	"{""exceptions"":[],""hold"":[""AUTHORITY_PENDING"",""SCOPE_PENDING""],""stop"":[""UNAUTHORIZED_EXTERNAL_TRANSITION""]}"	"[""C0"",""E0"",""I0"",""T0"",""V0""]"	"[""DER-JUST-N-O010-07""]"	"[""TC-N-O010-07-NEG"",""TC-N-O010-07-POS"",""TC-POSITIVE-FORMULATION-N-O010-07""]"	"[""CP-04"",""CP-06""]"	C03|C07	Actor, scope, delegation, decision owner, or validity evidence is incomplete.	"[""IDENTIFY_AUTHORITY_OWNER"",""OBTAIN_OR_REVOKE_DELEGATION"",""RECALCULATE_SCOPE""]"	A valid authority state, scope, owner, and evidence reference are recorded.	2.20	UNKNOWN_PRE_V2.18	2.20	v2.21:N-O010-07	5c530cfdb1584c204ec1d061299b031cd99f12ababa0c4f19ee5b8e41df1f0b8	73916db33e57c1d27818362117e0587bd2c27cc21269ccff951df7aabd686a69	a137bedb33d3c30b6dee0f9270c72b6037eb915587c75dade3a54cfef921c6a2
N-O010-10	BASE	ACTIVE		ACCEPTED_FOR_INTERPRETATION	TRUE	TRUE	FALSE	Degradation	When O010 is unavailable, the route remains limited to candidate and limited-fact recording. Operations requiring S3-S4 status, irreversible action, and concealment of a weak evidence circuit become eligible after O010 is restored or an explicitly authorized replacement contract is verified; ownership remains with O010.	O010	"[""core"",""organ:O010""]"	GOVERNANCE	MANDATORY_RULE	scope.boundary	scope.validity	"[""organ:O010""]"	"{""op"":""fact"",""path"":""violation.N-O010-10"",""equals"":true}"	MUST_NOT	KERNEL_COMPUTED	PROHIBIT		VIOLATED	[]	600	"{""counterevidence_policy"":""HOLD"",""freshness_requirement"":""ANY"",""independence_requirement"":""IND_ANY"",""minimum_epistemic_status"":""S0"",""minimum_evidence_count"":0,""required_source_classes"":[]}"	"[""OWNER_OR_SCOPE_PENDING""]"	"[""RULE_CONFLICT"",""OWNER_MISSING""]"	DECLARED_CONFORMING_STATE	PROHIBIT	scope.validity::DECLARED_CONFORMING_STATE	VIOLATED	"{""exceptions"":[],""hold"":[""OWNER_OR_SCOPE_PENDING""],""stop"":[""RULE_CONFLICT"",""OWNER_MISSING""]}"	"[""B0"",""C0"",""D0"",""E0"",""I0"",""T0"",""V0""]"	"[""DER-JUST-N-O010-10""]"	"[""TC-N-O010-10-NEG"",""TC-N-O010-10-POS"",""TC-POSITIVE-FORMULATION-N-O010-10""]"	"[""CP-01"",""CP-02"",""CP-03"",""CP-04""]"	ALL_PHASES|C03|C05|C07|EXTERNAL_ACTION|RECOVERY	Owner, layer, scope, precedence, conflict route, or change authority is incomplete.	"[""IDENTIFY_OWNER"",""DECLARE_SCOPE"",""RESOLVE_OR_REPAIR_CONFLICT"",""RECORD_AUTHORIZED_CHANGE""]"	Owner, scope, layer, precedence, and conflict or change route are recorded.	2.20	UNKNOWN_PRE_V2.18	2.20	v2.21:N-O010-10	3a3b2585c540e40c3d9eb2097d00146f29b075ae81e9a0bb2ad88cea36805d8a	e748f30d3c010acb99c2cbe811f71e939d88551247d6446b7ae2071a5ef299df	b7aa25fbfa3700a2cff057a19a8ce3e22766d641292b8ce39cb951b03870e7ba
N-O011-01	BASE	ACTIVE		ACCEPTED_FOR_INTERPRETATION	TRUE	TRUE	FALSE	S is mandatory	Every applicable epistemic object receives S0, S1, S2, S3, or S4 together with its scope and grounds.	O011	"[""core"",""organ:O011""]"	EVIDENCE	MANDATORY_RULE	epistemic.claim	epistemic.status	"[""organ:O011""]"	"{""op"":""always""}"	MUST	EVIDENCE_EVALUATED	REQUIRE	COMPLIANT		[]	600	"{""counterevidence_policy"":""HOLD"",""freshness_requirement"":""CURRENT"",""independence_requirement"":""IND_ANY"",""minimum_epistemic_status"":""S1"",""minimum_evidence_count"":1,""required_source_classes"":[]}"	"[""MISSING_EVIDENCE"",""UNRESOLVED_COUNTEREVIDENCE""]"	"[""EVIDENCE_FABRICATION""]"	COMPLIANT	REQUIRE	epistemic.status::COMPLIANT	DECLARED_CONFORMING_STATE	"{""exceptions"":[],""hold"":[""MISSING_EVIDENCE"",""UNRESOLVED_COUNTEREVIDENCE""],""stop"":[""EVIDENCE_FABRICATION""]}"	"[""B0"",""C0"",""D0"",""E0"",""I0"",""V0""]"	"[""DER-JUST-N-O011-01""]"	"[""TC-N-O011-01-NEG"",""TC-N-O011-01-POS"",""TC-POSITIVE-FORMULATION-N-O011-01""]"	"[""CP-01"",""CP-02"",""CP-04""]"	C03|C07	Source, provenance, scope, counterevidence, alternatives, or confidence boundary is incomplete.	"[""REBUILD_PROVENANCE"",""ADD_COUNTEREVIDENCE_CHECK"",""LOWER_CONFIDENCE"",""REOPEN_HYPOTHESIS""]"	The claim status, evidence, counterevidence, scope, and review conditions are recorded.	2.20	UNKNOWN_PRE_V2.18	2.20	v2.21:N-O011-01	5db407997d7f730a1b8832bbdf53b00976ecb5c96feca1ff05965d6c12175847	4dcadd7e11f05b5df51d0946ed954797a9301954a19b608a9a229a46e4c49446	de9034d29ac8107b407df5a1399d0fcde900ada7ca282125da81338f67c71faa
N-O011-02	BASE	ACTIVE		ACCEPTED_FOR_INTERPRETATION	TRUE	TRUE	FALSE	Three participants in a change	The domain organ proposes a change, the evidence organ verifies the grounds, and the status organ decides.	O011	"[""core"",""organ:O011""]"	EVIDENCE	MANDATORY_RULE	epistemic.claim	epistemic.status	"[""organ:O011""]"	"{""op"":""always""}"	MUST	EVIDENCE_EVALUATED	REQUIRE	COMPLIANT		[]	600	"{""counterevidence_policy"":""HOLD"",""freshness_requirement"":""CURRENT"",""independence_requirement"":""IND_ANY"",""minimum_epistemic_status"":""S1"",""minimum_evidence_count"":1,""required_source_classes"":[]}"	"[""MISSING_EVIDENCE"",""UNRESOLVED_COUNTEREVIDENCE""]"	"[""EVIDENCE_FABRICATION""]"	COMPLIANT	REQUIRE	epistemic.status::COMPLIANT	DECLARED_CONFORMING_STATE	"{""exceptions"":[],""hold"":[""MISSING_EVIDENCE"",""UNRESOLVED_COUNTEREVIDENCE""],""stop"":[""EVIDENCE_FABRICATION""]}"	"[""B0"",""C0"",""D0"",""E0"",""I0"",""V0""]"	"[""DER-JUST-N-O011-02""]"	"[""TC-N-O011-02-NEG"",""TC-N-O011-02-POS"",""TC-POSITIVE-FORMULATION-N-O011-02""]"	"[""CP-01"",""CP-02"",""CP-04""]"	C02|C03|C07	Source, provenance, scope, counterevidence, alternatives, or confidence boundary is incomplete.	"[""REBUILD_PROVENANCE"",""ADD_COUNTEREVIDENCE_CHECK"",""LOWER_CONFIDENCE"",""REOPEN_HYPOTHESIS""]"	The claim status, evidence, counterevidence, scope, and review conditions are recorded.	2.20	UNKNOWN_PRE_V2.18	2.20	v2.21:N-O011-02	b6a6d818835f7fded7084112691431231c0003b64d534e48b298e9a0e2dbfb80	9d6aa32a5641f4902216cf7b84f0df45bb1390e977eeb39369a286670a403f5e	79d98086c082580af2e7cc2cadccd8d4f79d29d77dfa71196ecaf2c8efddc2ca
N-O011-03	BASE	ACTIVE		ACCEPTED_FOR_INTERPRETATION	TRUE	TRUE	FALSE	Weak critical link	A coupled inference is limited by its weakest required link; independent sufficient routes may increase resilience.	O011	"[""core"",""organ:O011""]"	EVIDENCE	MANDATORY_RULE	epistemic.claim	epistemic.status	"[""organ:O011""]"	"{""op"":""always""}"	MAY	EVIDENCE_EVALUATED	PERMIT	PERMITTED		[]	600	"{""counterevidence_policy"":""HOLD"",""freshness_requirement"":""CURRENT"",""independence_requirement"":""IND_ANY"",""minimum_epistemic_status"":""S1"",""minimum_evidence_count"":1,""required_source_classes"":[]}"	"[""MISSING_EVIDENCE"",""UNRESOLVED_COUNTEREVIDENCE""]"	"[""EVIDENCE_FABRICATION""]"	PERMITTED	PERMIT	epistemic.status::PERMITTED	DECLARED_CONFORMING_STATE	"{""exceptions"":[],""hold"":[""MISSING_EVIDENCE"",""UNRESOLVED_COUNTEREVIDENCE""],""stop"":[""EVIDENCE_FABRICATION""]}"	"[""C0"",""E0"",""I0""]"	"[""DER-JUST-N-O011-03""]"	"[""TC-N-O011-03-NEG"",""TC-N-O011-03-POS"",""TC-POSITIVE-FORMULATION-N-O011-03""]"	"[""CP-04""]"	C03|C05|C06|C07	Source, provenance, scope, counterevidence, alternatives, or confidence boundary is incomplete.	"[""REBUILD_PROVENANCE"",""ADD_COUNTEREVIDENCE_CHECK"",""LOWER_CONFIDENCE"",""REOPEN_HYPOTHESIS""]"	The claim status, evidence, counterevidence, scope, and review conditions are recorded.	2.22	UNKNOWN_PRE_V2.18	2.22	v2.21:N-O011-03	43d7001a17a6a8493b99e064ee2bf06cb54c4b0b3aefffdf67cb6f4e5166214f	7ac39d450275587cb9c8122db12fa0dc9afff4963392338b2bb1ee5ac75ad7e7	8400d4fc2fb00fefab23b6e10a1ac7abc39de7b71502b0f0859caec2344a2d95
N-O011-04	BASE	ACTIVE		ACCEPTED_FOR_INTERPRETATION	TRUE	TRUE	FALSE	Influence profile	A component is classified as decisive, high, moderate, low, negligible, uncertain, or irreducible according to its actual influence.	O011	"[""core"",""organ:O011""]"	SURFACE	MANDATORY_RULE	organ.O011.output	output.conformance	"[""organ:O011""]"	"{""op"":""always""}"	MUST	EVIDENCE_EVALUATED	REQUIRE	COMPLIANT		[]	600	"{""counterevidence_policy"":""HOLD"",""freshness_requirement"":""CURRENT"",""independence_requirement"":""IND_ANY"",""minimum_epistemic_status"":""S1"",""minimum_evidence_count"":1,""required_source_classes"":[]}"	"[""SURFACE_INCOMPLETE""]"	"[""FORMAT_LOSS""]"	COMPLIANT	REQUIRE	output.conformance::COMPLIANT	DECLARED_CONFORMING_STATE	"{""exceptions"":[],""hold"":[""SURFACE_INCOMPLETE""],""stop"":[""FORMAT_LOSS""]}"	"[""C0"",""E0"",""I0""]"	"[""DER-JUST-N-O011-04""]"	"[""TC-N-O011-04-NEG"",""TC-N-O011-04-POS"",""TC-POSITIVE-FORMULATION-N-O011-04""]"	"[""CP-04""]"	C08	Meaning, identifier, language boundary, required block, or readability condition is missing.	"[""RESTORE_REQUIRED_CONTENT"",""SIMPLIFY_LAYOUT"",""PRESERVE_CANONICAL_IDENTIFIER"",""RERENDER_AND_REVIEW""]"	The surface preserves the canonical meaning, boundary, identifiers, and required visible fields.	2.20	UNKNOWN_PRE_V2.18	2.20	v2.21:N-O011-04	a3ed8c9fcdd1f9564a09db85dfc3a1e72c3536531be626ee989d691ca19e1b57	e0d7541eae4b899f42352f55357826b0b58120e9d17b9295794b8710aaf8ccbc	85cdcab58aee40e93caaf6f196925dd2da7a6130592a1b2f161a47472ac9bb00
N-O011-05	BASE	ACTIVE		ACCEPTED_FOR_INTERPRETATION	TRUE	TRUE	FALSE	Temporary downgrade	After a material revision, the affected working S-level enters one explicit temporary downgrade and is recalculated from the latest validated evidence before further use.	O011	"[""core"",""organ:O011""]"	GOVERNANCE	MANDATORY_RULE	scope.boundary	scope.validity	"[""organ:O011""]"	"{""op"":""always""}"	MUST	EVIDENCE_EVALUATED	REQUIRE	COMPLIANT		[]	600	"{""counterevidence_policy"":""HOLD"",""freshness_requirement"":""CURRENT"",""independence_requirement"":""IND_ANY"",""minimum_epistemic_status"":""S1"",""minimum_evidence_count"":1,""required_source_classes"":[]}"	"[""OWNER_OR_SCOPE_PENDING""]"	"[""RULE_CONFLICT"",""OWNER_MISSING""]"	COMPLIANT	REQUIRE	scope.validity::COMPLIANT	DECLARED_CONFORMING_STATE	"{""exceptions"":[],""hold"":[""OWNER_OR_SCOPE_PENDING""],""stop"":[""RULE_CONFLICT"",""OWNER_MISSING""]}"	"[""B0"",""C0"",""D0"",""E0"",""I0"",""T0"",""V0""]"	"[""DER-JUST-N-O011-05""]"	"[""TC-N-O011-05-NEG"",""TC-N-O011-05-POS"",""TC-POSITIVE-FORMULATION-N-O011-05""]"	"[""CP-01"",""CP-02"",""CP-04"",""CP-05""]"	ALL_PHASES|C03|C07	Owner, layer, scope, precedence, conflict route, or change authority is incomplete.	"[""IDENTIFY_OWNER"",""DECLARE_SCOPE"",""RESOLVE_OR_REPAIR_CONFLICT"",""RECORD_AUTHORIZED_CHANGE""]"	Owner, scope, layer, precedence, and conflict or change route are recorded.	2.20	UNKNOWN_PRE_V2.18	2.20	v2.21:N-O011-05	7b46b164f33421c9b4e01650e08171b65a480377d837d1ff62b69bebd8fe04e7	9cf017071ea1f774f49e09f57d0c047955c0b240e7c3dccfe5b237bea72b503e	3f55a1a9adef55a449eac45eab2425d5a5d85393adbde4ead12ae01f3ea4c6cd
N-O011-06	BASE	ACTIVE		ACCEPTED_FOR_INTERPRETATION	TRUE	TRUE	FALSE	Functional suitability	One object may have different allowable S levels for a question, model, ranking, external action, and normative decision.	O011	"[""core"",""organ:O011""]"	EVIDENCE	MANDATORY_RULE	epistemic.claim	epistemic.status	"[""organ:O011""]"	"{""op"":""always""}"	MAY	EVIDENCE_EVALUATED	PERMIT	PERMITTED		[]	600	"{""counterevidence_policy"":""HOLD"",""freshness_requirement"":""CURRENT"",""independence_requirement"":""IND_ANY"",""minimum_epistemic_status"":""S1"",""minimum_evidence_count"":1,""required_source_classes"":[]}"	"[""MISSING_EVIDENCE"",""UNRESOLVED_COUNTEREVIDENCE""]"	"[""EVIDENCE_FABRICATION""]"	PERMITTED	PERMIT	epistemic.status::PERMITTED	DECLARED_CONFORMING_STATE	"{""exceptions"":[],""hold"":[""MISSING_EVIDENCE"",""UNRESOLVED_COUNTEREVIDENCE""],""stop"":[""EVIDENCE_FABRICATION""]}"	"[""C0"",""E0"",""I0"",""T0"",""V0""]"	"[""DER-JUST-N-O011-06""]"	"[""TC-N-O011-06-NEG"",""TC-N-O011-06-POS"",""TC-POSITIVE-FORMULATION-N-O011-06""]"	"[""CP-03"",""CP-04""]"	C03|C04|C06|C07|C10|EXTERNAL_ACTION	Source, provenance, scope, counterevidence, alternatives, or confidence boundary is incomplete.	"[""REBUILD_PROVENANCE"",""ADD_COUNTEREVIDENCE_CHECK"",""LOWER_CONFIDENCE"",""REOPEN_HYPOTHESIS""]"	The claim status, evidence, counterevidence, scope, and review conditions are recorded.	2.22	UNKNOWN_PRE_V2.18	2.22	v2.21:N-O011-06	ffe932815ecbec8c6f1838b4ae02eab0762222ac688ff0f7450d9aac65b7c1f7	8972957c63442ce2d06036bcc99485a5e0b5ede526efb33ba9e2d944912fa3f8	32c9bfd0ec8c412cab62a2c9727d1a5b6daac55734d15ae870c253b4121731ad
N-O011-07	BASE	ACTIVE		ACCEPTED_FOR_INTERPRETATION	TRUE	TRUE	FALSE	Object ownership	O011 retains accountable ownership of its calculating element, influence profile, critical link, functional suitability, and substrate assignment; contributing organs supply typed inputs and preserve ownership of their own outputs.	O011	"[""core"",""organ:O011""]"	AUTHORITY	MANDATORY_RULE	agency.authorization	authorization.status	"[""organ:O011""]"	"{""op"":""fact"",""path"":""violation.N-O011-07"",""equals"":true}"	MUST_NOT	KERNEL_COMPUTED	PROHIBIT		VIOLATED	[]	600	"{""counterevidence_policy"":""HOLD"",""freshness_requirement"":""ANY"",""independence_requirement"":""IND_ANY"",""minimum_epistemic_status"":""S0"",""minimum_evidence_count"":0,""required_source_classes"":[]}"	"[""AUTHORITY_PENDING"",""SCOPE_PENDING""]"	"[""UNAUTHORIZED_EXTERNAL_TRANSITION""]"	DECLARED_CONFORMING_STATE	PROHIBIT	authorization.status::DECLARED_CONFORMING_STATE	VIOLATED	"{""exceptions"":[],""hold"":[""AUTHORITY_PENDING"",""SCOPE_PENDING""],""stop"":[""UNAUTHORIZED_EXTERNAL_TRANSITION""]}"	"[""C0"",""E0"",""I0"",""T0"",""V0""]"	"[""DER-JUST-N-O011-07""]"	"[""TC-N-O011-07-NEG"",""TC-N-O011-07-POS"",""TC-POSITIVE-FORMULATION-N-O011-07""]"	"[""CP-04"",""CP-06""]"	C02|C03|C07	Actor, scope, delegation, decision owner, or validity evidence is incomplete.	"[""IDENTIFY_AUTHORITY_OWNER"",""OBTAIN_OR_REVOKE_DELEGATION"",""RECALCULATE_SCOPE""]"	A valid authority state, scope, owner, and evidence reference are recorded.	2.22	UNKNOWN_PRE_V2.18	2.22	v2.21:N-O011-07	f3b35e79db9fee76992cd529de580f67cfb916f6077a03460b05b4e650ae8e2d	c986811bf20d04292638729aacf5311d7664d56dad35837029c8592276282e6a	827941b8d8fed9d784613eb5ef8e5070173ca01c9670c48063bb2c3552d542e8
N-O011-10	BASE	ACTIVE		ACCEPTED_FOR_INTERPRETATION	TRUE	TRUE	FALSE	Degradation	When O011 is unavailable, the route remains limited to historical S as reference and an explicitly temporary working S. Operations requiring escalation and use outside the verified function become eligible after O011 is restored or an explicitly authorized replacement contract is verified; ownership remains with O011.	O011	"[""core"",""organ:O011""]"	GOVERNANCE	MANDATORY_RULE	scope.boundary	scope.validity	"[""organ:O011""]"	"{""op"":""fact"",""path"":""violation.N-O011-10"",""equals"":true}"	MUST_NOT	KERNEL_COMPUTED	PROHIBIT		VIOLATED	[]	600	"{""counterevidence_policy"":""HOLD"",""freshness_requirement"":""ANY"",""independence_requirement"":""IND_ANY"",""minimum_epistemic_status"":""S0"",""minimum_evidence_count"":0,""required_source_classes"":[]}"	"[""OWNER_OR_SCOPE_PENDING""]"	"[""RULE_CONFLICT"",""OWNER_MISSING""]"	DECLARED_CONFORMING_STATE	PROHIBIT	scope.validity::DECLARED_CONFORMING_STATE	VIOLATED	"{""exceptions"":[],""hold"":[""OWNER_OR_SCOPE_PENDING""],""stop"":[""RULE_CONFLICT"",""OWNER_MISSING""]}"	"[""B0"",""C0"",""D0"",""E0"",""I0"",""V0""]"	"[""DER-JUST-N-O011-10""]"	"[""TC-N-O011-10-NEG"",""TC-N-O011-10-POS"",""TC-POSITIVE-FORMULATION-N-O011-10""]"	"[""CP-01"",""CP-02""]"	ALL_PHASES|C05|RECOVERY	Owner, layer, scope, precedence, conflict route, or change authority is incomplete.	"[""IDENTIFY_OWNER"",""DECLARE_SCOPE"",""RESOLVE_OR_REPAIR_CONFLICT"",""RECORD_AUTHORIZED_CHANGE""]"	Owner, scope, layer, precedence, and conflict or change route are recorded.	2.20	UNKNOWN_PRE_V2.18	2.20	v2.21:N-O011-10	8a2d454a49b53a94fbceaa2e3b243c36ad7963fd46962f1ca40b8ffd5f117790	3aefd08d2d955923a070ee6f915232f7ed84eefee264a090e3a28f8e8b1e0edd	7f9ba6d87976dc6a344f9d9e3b26d4d3e599611215929d7366679af5213d8f06
N-O012-01	BASE	ACTIVE		ACCEPTED_FOR_INTERPRETATION	TRUE	TRUE	FALSE	English normative canon	The active human-readable canon is formulated in English; non-English designations are accompanied by their English meaning at first use.	O012	"[""core"",""organ:O012""]"	RELEASE	MANDATORY_RULE	release.package	release.integrity	"[""organ:O012""]"	"{""op"":""always""}"	MUST	EVIDENCE_EVALUATED	REQUIRE	COMPLIANT		[]	600	"{""counterevidence_policy"":""HOLD"",""freshness_requirement"":""CURRENT"",""independence_requirement"":""IND_ANY"",""minimum_epistemic_status"":""S1"",""minimum_evidence_count"":1,""required_source_classes"":[]}"	"[""PACKAGE_INCOMPLETE""]"	"[""PACKAGE_MISMATCH""]"	COMPLIANT	REQUIRE	release.integrity::COMPLIANT	DECLARED_CONFORMING_STATE	"{""exceptions"":[],""hold"":[""PACKAGE_INCOMPLETE""],""stop"":[""PACKAGE_MISMATCH""]}"	"[""C0"",""E0"",""I0"",""T0"",""V0""]"	"[""DER-JUST-N-O012-01""]"	"[""TC-N-O012-01-NEG"",""TC-N-O012-01-POS"",""TC-POSITIVE-FORMULATION-N-O012-01""]"	"[""CP-04"",""CP-06""]"	PACKAGE_BUILD	Required component, version, manifest entry, checksum, compatibility statement, or verification result is incomplete.	"[""REBUILD_COMPONENT"",""REGENERATE_MANIFEST"",""RECALCULATE_HASHES"",""RERUN_FINAL_VERIFICATION""]"	All required components, hashes, compatibility, and verification statuses are recorded.	2.20	UNKNOWN_PRE_V2.18	2.20	v2.21:N-O012-01	f6af32711716bd13e722da641802e3e8cb840def12efbd228d89032f66b96ddb	d34e69256f28ad8052b034fefaf1a001b2cac24d42e207e68415aaa449acab11	6b675d7fd4aea57bf0f6d387e7a6eab02e54f5c0a4a20fb6271a15dde07a51dd
N-O012-02	BASE	ACTIVE		ACCEPTED_FOR_INTERPRETATION	TRUE	TRUE	FALSE	Statement types	Definition, invariant, mandatory rule, conditional rule, permission, recommendation, rationale, example, and note are distinguished.	O012	"[""core"",""organ:O012""]"	AUTHORITY	MANDATORY_RULE	agency.authorization	authorization.status	"[""organ:O012""]"	"{""op"":""always""}"	MUST	EVIDENCE_EVALUATED	REQUIRE	COMPLIANT		[]	600	"{""counterevidence_policy"":""HOLD"",""freshness_requirement"":""CURRENT"",""independence_requirement"":""IND_ANY"",""minimum_epistemic_status"":""S1"",""minimum_evidence_count"":1,""required_source_classes"":[]}"	"[""AUTHORITY_PENDING"",""SCOPE_PENDING""]"	"[""UNAUTHORIZED_EXTERNAL_TRANSITION""]"	COMPLIANT	REQUIRE	authorization.status::COMPLIANT	DECLARED_CONFORMING_STATE	"{""exceptions"":[],""hold"":[""AUTHORITY_PENDING"",""SCOPE_PENDING""],""stop"":[""UNAUTHORIZED_EXTERNAL_TRANSITION""]}"	"[""C0"",""E0"",""I0"",""T0"",""V0""]"	"[""DER-JUST-N-O012-02""]"	"[""TC-N-O012-02-NEG"",""TC-N-O012-02-POS"",""TC-POSITIVE-FORMULATION-N-O012-02""]"	"[""CP-04"",""CP-05"",""CP-06""]"	C02|C03|C07	Actor, scope, delegation, decision owner, or validity evidence is incomplete.	"[""IDENTIFY_AUTHORITY_OWNER"",""OBTAIN_OR_REVOKE_DELEGATION"",""RECALCULATE_SCOPE""]"	A valid authority state, scope, owner, and evidence reference are recorded.	2.22	UNKNOWN_PRE_V2.18	2.22	v2.21:N-O012-02	fa0f20bb811f7ce931929fff9d5f2957af13120be6a342c459c580519bd7106a	bf62a22b134dae45437606cc8727cbb0919fe8f4ded55c3533cf6c487a7c917b	036fc2191eb497057137832dce7a2b7cbd0835035b791dd97d6fd47ffaf2d0c3
N-O012-03	BASE	ACTIVE		ACCEPTED_FOR_INTERPRETATION	TRUE	TRUE	FALSE	Norm identity	An editorial change preserves norm_id; a semantic change creates a new norm and a relation to its predecessor.	O012	"[""core"",""organ:O012""]"	SURFACE	MANDATORY_RULE	organ.O012.output	output.conformance	"[""organ:O012""]"	"{""op"":""always""}"	MUST	EVIDENCE_EVALUATED	REQUIRE	COMPLIANT		[]	600	"{""counterevidence_policy"":""HOLD"",""freshness_requirement"":""CURRENT"",""independence_requirement"":""IND_ANY"",""minimum_epistemic_status"":""S1"",""minimum_evidence_count"":1,""required_source_classes"":[]}"	"[""SURFACE_INCOMPLETE""]"	"[""FORMAT_LOSS""]"	COMPLIANT	REQUIRE	output.conformance::COMPLIANT	DECLARED_CONFORMING_STATE	"{""exceptions"":[],""hold"":[""SURFACE_INCOMPLETE""],""stop"":[""FORMAT_LOSS""]}"	"[""C0"",""E0"",""I0""]"	"[""DER-JUST-N-O012-03""]"	"[""TC-N-O012-03-NEG"",""TC-N-O012-03-POS"",""TC-POSITIVE-FORMULATION-N-O012-03""]"	"[""CP-04""]"	C08	Meaning, identifier, language boundary, required block, or readability condition is missing.	"[""RESTORE_REQUIRED_CONTENT"",""SIMPLIFY_LAYOUT"",""PRESERVE_CANONICAL_IDENTIFIER"",""RERENDER_AND_REVIEW""]"	The surface preserves the canonical meaning, boundary, identifiers, and required visible fields.	2.20	UNKNOWN_PRE_V2.18	2.20	v2.21:N-O012-03	aa6ebd6ed9a414b337c004057e7eb6036a212ef05069610923a4ab268646df2a	d1d622695b9ad724c51c1e75bac9190236fb926ce3d5ac7cdb15191fdcd53ad5	d8511eaadd69e0498bf5a84556957ceda5ec407de75a9458bf1417ec06aea3e4
N-O012-04	BASE	ACTIVE		ACCEPTED_FOR_INTERPRETATION	TRUE	TRUE	FALSE	Canon prevails over derivative forms	The English human-readable canon remains the normative source, while machine maps, schemas, and execution surfaces remain traced derivative representations.	O012	"[""core"",""organ:O012""]"	RELEASE	MANDATORY_RULE	release.package	release.integrity	"[""organ:O012""]"	"{""op"":""fact"",""path"":""violation.N-O012-04"",""equals"":true}"	MUST_NOT	KERNEL_COMPUTED	PROHIBIT		VIOLATED	[]	600	"{""counterevidence_policy"":""HOLD"",""freshness_requirement"":""ANY"",""independence_requirement"":""IND_ANY"",""minimum_epistemic_status"":""S0"",""minimum_evidence_count"":0,""required_source_classes"":[]}"	"[""PACKAGE_INCOMPLETE""]"	"[""PACKAGE_MISMATCH""]"	DECLARED_CONFORMING_STATE	PROHIBIT	release.integrity::DECLARED_CONFORMING_STATE	VIOLATED	"{""exceptions"":[],""hold"":[""PACKAGE_INCOMPLETE""],""stop"":[""PACKAGE_MISMATCH""]}"	"[""C0"",""E0"",""I0""]"	"[""DER-JUST-N-O012-04""]"	"[""TC-N-O012-04-NEG"",""TC-N-O012-04-POS"",""TC-POSITIVE-FORMULATION-N-O012-04""]"	"[""CP-04""]"	C03|C07|C08|PACKAGE_BUILD|EXTERNAL_ACTION	Required component, version, manifest entry, checksum, compatibility statement, or verification result is incomplete.	"[""REBUILD_COMPONENT"",""REGENERATE_MANIFEST"",""RECALCULATE_HASHES"",""RERUN_FINAL_VERIFICATION""]"	All required components, hashes, compatibility, and verification statuses are recorded.	2.22	UNKNOWN_PRE_V2.18	2.22	v2.21:N-O012-04	4121ecf639285dfc87cf772e550dd9cc19a0369bfe464ba690e15ec8acf2e948	efd81ec04985f7c38ef2c558e5fdb9dc9e93c4a0d783258a149d48b0bbde02ae	ec93126f0fea5793a0b4c4533c881f89eceb1c01aa822212f238c37c3078920d
N-O012-05	BASE	ACTIVE		ACCEPTED_FOR_INTERPRETATION	TRUE	TRUE	FALSE	Translation equivalence	A translation has its own provenance, scope, ambiguities, and a check of semantic equivalence.	O012	"[""core"",""organ:O012""]"	GOVERNANCE	MANDATORY_RULE	scope.boundary	scope.validity	"[""organ:O012""]"	"{""op"":""always""}"	MUST	EVIDENCE_EVALUATED	REQUIRE	COMPLIANT		[]	600	"{""counterevidence_policy"":""HOLD"",""freshness_requirement"":""CURRENT"",""independence_requirement"":""IND_ANY"",""minimum_epistemic_status"":""S1"",""minimum_evidence_count"":1,""required_source_classes"":[]}"	"[""OWNER_OR_SCOPE_PENDING""]"	"[""RULE_CONFLICT"",""OWNER_MISSING""]"	COMPLIANT	REQUIRE	scope.validity::COMPLIANT	DECLARED_CONFORMING_STATE	"{""exceptions"":[],""hold"":[""OWNER_OR_SCOPE_PENDING""],""stop"":[""RULE_CONFLICT"",""OWNER_MISSING""]}"	"[""B0"",""C0"",""D0"",""E0"",""I0"",""V0""]"	"[""DER-JUST-N-O012-05""]"	"[""TC-N-O012-05-NEG"",""TC-N-O012-05-POS"",""TC-POSITIVE-FORMULATION-N-O012-05""]"	"[""CP-01"",""CP-02"",""CP-04""]"	ALL_PHASES|C03|C07	Owner, layer, scope, precedence, conflict route, or change authority is incomplete.	"[""IDENTIFY_OWNER"",""DECLARE_SCOPE"",""RESOLVE_OR_REPAIR_CONFLICT"",""RECORD_AUTHORIZED_CHANGE""]"	Owner, scope, layer, precedence, and conflict or change route are recorded.	2.20	UNKNOWN_PRE_V2.18	2.20	v2.21:N-O012-05	c75f480349869fd0207100b8dd8f249a61c61e6fa82c215fce59788da539f279	008010dc2e7b8cf0ab16a7b0bc0fe975c13cf3255a298718bb7e646aef55483b	4d395b9315d17b31a3685f3c1e42b25222743f437ffeb660df10a79ca4c9eb01
